,user_review,pengalaman visual,fungsi,performa dan stabilitas,case_fold,remove_punctuation,remove_whitespace,stopword_removal,normalize,tokenize
541,Aku pengen kasih bintang sepuluh tapi cuma bisa lima aku suka podcast di culik ke alam lain aku suka banget nonton itu malam malam aku harus dengerin terus podcast nya,0,0,0,aku pengen kasih bintang sepuluh tapi cuma bisa lima aku suka podcast di culik ke alam lain aku suka banget nonton itu malam malam aku harus dengerin terus podcast nya,aku pengen kasih bintang sepuluh tapi cuma bisa lima aku suka podcast di culik ke alam lain aku suka banget nonton itu malam malam aku harus dengerin terus podcast nya,aku pengen kasih bintang sepuluh tapi cuma bisa lima aku suka podcast di culik ke alam lain aku suka banget nonton itu malam malam aku harus dengerin terus podcast nya,pengen kasih bintang sepuluh suka podcast culik alam suka banget nonton malam malam dengerin podcast nya,pengin kasih bintang sepuluh suka podcast culik alam suka banget menonton malam malam dengarkan podcast nya,"['pengin', 'kasih', 'bintang', 'sepuluh', 'suka', 'podcast', 'culik', 'alam', 'suka', 'banget', 'menonton', 'malam', 'malam', 'dengarkan', 'podcast', 'nya']"
542,"Kesini mau cari referensi Podcast, Buset isi nya kebanyak IKLAN, mending spotify G ada iklan nya.",0,0,0,"kesini mau cari referensi podcast, buset isi nya kebanyak iklan, mending spotify g ada iklan nya.",kesini mau cari referensi podcast buset isi nya kebanyak iklan mending spotify g ada iklan nya,kesini mau cari referensi podcast buset isi nya kebanyak iklan mending spotify g ada iklan nya,kesini cari referensi podcast buset isi nya kebanyak iklan mending spotify g iklan nya,kesini cari referensi podcast buset isi nya kebanyak iklan mending spotify enggak iklan nya,"['kesini', 'cari', 'referensi', 'podcast', 'buset', 'isi', 'nya', 'kebanyak', 'iklan', 'mending', 'spotify', 'enggak', 'iklan', 'nya']"
543,Jelek .. sering lag .. padahal jaringan bagus ...,0,0,-1,jelek .. sering lag .. padahal jaringan bagus ...,jelek  sering lag  padahal jaringan bagus ,jelek  sering lag  padahal jaringan bagus,jelek lag jaringan bagus,jelek lag jaringan bagus,"['jelek', 'lag', 'jaringan', 'bagus']"
544,"baru sehari pake dan mutusin buat uninstall aja, kdg nge lag pdhl jaringan bagus aja, terus iklannya terus2an muncul",0,0,-1,"baru sehari pake dan mutusin buat uninstall aja, kdg nge lag pdhl jaringan bagus aja, terus iklannya terus2an muncul",baru sehari pake dan mutusin buat uninstall aja kdg nge lag pdhl jaringan bagus aja terus iklannya terus2an muncul,baru sehari pake dan mutusin buat uninstall aja kdg nge lag pdhl jaringan bagus aja terus iklannya terus2an muncul,sehari pake mutusin uninstall aja kdg nge lag pdhl jaringan bagus aja iklannya terus2an muncul,sehari pakai memutuskan uninstall saja kdg nge lag padahal jaringan bagus saja iklannya terus2an muncul,"['sehari', 'pakai', 'memutuskan', 'uninstall', 'saja', 'kdg', 'nge', 'lag', 'padahal', 'jaringan', 'bagus', 'saja', 'iklannya', 'terus2an', 'muncul']"
545,"tolong Volume iklannya di kecilin, kaget gw tiba iklan ""Kamu lahh satu2nyaaaa..."" Cempreeeeeengggg",0,0,0,"tolong volume iklannya di kecilin, kaget gw tiba iklan ""kamu lahh satu2nyaaaa..."" cempreeeeeengggg",tolong volume iklannya di kecilin kaget gw tiba iklan kamu lahh satu2nyaaaa cempreeeeeengggg,tolong volume iklannya di kecilin kaget gw tiba iklan kamu lahh satu2nyaaaa cempreeeeeengggg,tolong volume iklannya kecilin kaget gw iklan lahh satu2nyaaaa cempreeeeeengggg,tolong volume iklannya kecilin kaget gue iklan lah satu2nyaaaa cempreeeeeengggg,"['tolong', 'volume', 'iklannya', 'kecilin', 'kaget', 'gue', 'iklan', 'lah', 'satu2nyaaaa', 'cempreeeeeengggg']"
546,Suara iklan telkomselnya kenceng banget,0,0,0,suara iklan telkomselnya kenceng banget,suara iklan telkomselnya kenceng banget,suara iklan telkomselnya kenceng banget,suara iklan telkomselnya kenceng banget,suara iklan telkomselnya kencang banget,"['suara', 'iklan', 'telkomselnya', 'kencang', 'banget']"
547,Too much paywall contents now. A big disappointed as an old listener of this podcast.,0,0,0,too much paywall contents now. a big disappointed as an old listener of this podcast.,too much paywall contents now a big disappointed as an old listener of this podcast,too much paywall contents now a big disappointed as an old listener of this podcast,too much paywall contents now a big disappointed as an old listener of this podcast,too much paywall contents now a big disappointed as an old listener of this podcast,"['too', 'much', 'paywall', 'contents', 'now', 'a', 'big', 'disappointed', 'as', 'an', 'old', 'listener', 'of', 'this', 'podcast']"
548,"Sering mati sendiri, jadi berhenti dulu lah dengerin noice sampai dibenerin appsnya",0,0,-1,"sering mati sendiri, jadi berhenti dulu lah dengerin noice sampai dibenerin appsnya",sering mati sendiri jadi berhenti dulu lah dengerin noice sampai dibenerin appsnya,sering mati sendiri jadi berhenti dulu lah dengerin noice sampai dibenerin appsnya,mati berhenti dengerin noice dibenerin appsnya,mati berhenti dengarkan noice dibenerin appsnya,"['mati', 'berhenti', 'dengarkan', 'noice', 'dibenerin', 'appsnya']"
549,kasih fitur SORT di podcast yg udah di download dong plisss,0,0,0,kasih fitur sort di podcast yg udah di download dong plisss,kasih fitur sort di podcast yg udah di download dong plisss,kasih fitur sort di podcast yg udah di download dong plisss,kasih fitur sort podcast yg udah download plisss,kasih fitur sort podcast yang sudah download plisss,"['kasih', 'fitur', 'sort', 'podcast', 'yang', 'sudah', 'download', 'plisss']"
550,Apk ngebug lagi dengerin tiba tiba mati sendiri,0,0,-1,apk ngebug lagi dengerin tiba tiba mati sendiri,apk ngebug lagi dengerin tiba tiba mati sendiri,apk ngebug lagi dengerin tiba tiba mati sendiri,apk ngebug dengerin mati,aplikasi ngebug dengarkan mati,"['aplikasi', 'ngebug', 'dengarkan', 'mati']"
551,"Sekarang udah bisa dengerin Noice di versi web lewat PC atau Laptop, terima kasih atas kerja keras nya Noice =D Jadi sekarang bisa dengerin Noice tanpa khawatir HP lowbat saat Kerja ^_^ Semoga sistem log in dan download di versi web jadi lebih mudah kedepannya.",0,0,0,"sekarang udah bisa dengerin noice di versi web lewat pc atau laptop, terima kasih atas kerja keras nya noice =d jadi sekarang bisa dengerin noice tanpa khawatir hp lowbat saat kerja ^_^ semoga sistem log in dan download di versi web jadi lebih mudah kedepannya.",sekarang udah bisa dengerin noice di versi web lewat pc atau laptop terima kasih atas kerja keras nya noice d jadi sekarang bisa dengerin noice tanpa khawatir hp lowbat saat kerja _ semoga sistem log in dan download di versi web jadi lebih mudah kedepannya,sekarang udah bisa dengerin noice di versi web lewat pc atau laptop terima kasih atas kerja keras nya noice d jadi sekarang bisa dengerin noice tanpa khawatir hp lowbat saat kerja _ semoga sistem log in dan download di versi web jadi lebih mudah kedepannya,udah dengerin noice versi web pc laptop terima kasih kerja keras nya noice d dengerin noice khawatir hp lowbat kerja _ semoga sistem log in download versi web mudah kedepannya,sudah dengarkan noice versi web pc laptop terima kasih kerja keras nya noice di dengarkan noice khawatir hp lowbat kerja _ semoga sistem log ini download versi web mudah kedepannya,"['sudah', 'dengarkan', 'noice', 'versi', 'web', 'pc', 'laptop', 'terima', 'kasih', 'kerja', 'keras', 'nya', 'noice', 'di', 'dengarkan', 'noice', 'khawatir', 'hp', 'lowbat', 'kerja', '_', 'semoga', 'sistem', 'log', 'ini', 'download', 'versi', 'web', 'mudah', 'kedepannya']"
552,Ini gimana ya? Udah mau sebulan aplikasi gak bisa di buka?,0,0,-1,ini gimana ya? udah mau sebulan aplikasi gak bisa di buka?,ini gimana ya udah mau sebulan aplikasi gak bisa di buka,ini gimana ya udah mau sebulan aplikasi gak bisa di buka,gimana ya udah sebulan aplikasi gak buka,bagaimana ya sudah sebulan aplikasi enggak buka,"['bagaimana', 'ya', 'sudah', 'sebulan', 'aplikasi', 'enggak', 'buka']"
553,Min setelah update mlh tiba tiba berhenti pas diplay ngulang dari awal tolong cepat diperbaiki ganggu banget,0,0,-1,min setelah update mlh tiba tiba berhenti pas diplay ngulang dari awal tolong cepat diperbaiki ganggu banget,min setelah update mlh tiba tiba berhenti pas diplay ngulang dari awal tolong cepat diperbaiki ganggu banget,min setelah update mlh tiba tiba berhenti pas diplay ngulang dari awal tolong cepat diperbaiki ganggu banget,min update mlh berhenti pas diplay ngulang tolong cepat diperbaiki ganggu banget,min update malah berhenti pas diplay ngulang tolong cepat diperbaiki ganggu banget,"['min', 'update', 'malah', 'berhenti', 'pas', 'diplay', 'ngulang', 'tolong', 'cepat', 'diperbaiki', 'ganggu', 'banget']"
554,"kok suka tiba-tiba mati sendiri ya? lg asik denger podcast, mati.. dan sering bgt gtu belakangan ini",0,0,-1,"kok suka tiba-tiba mati sendiri ya? lg asik denger podcast, mati.. dan sering bgt gtu belakangan ini",kok suka tibatiba mati sendiri ya lg asik denger podcast mati dan sering bgt gtu belakangan ini,kok suka tibatiba mati sendiri ya lg asik denger podcast mati dan sering bgt gtu belakangan ini,suka tibatiba mati ya lg asik denger podcast mati bgt gtu,suka tibatiba mati ya lagi asik dengar podcast mati banget begitu,"['suka', 'tibatiba', 'mati', 'ya', 'lagi', 'asik', 'dengar', 'podcast', 'mati', 'banget', 'begitu']"
555,Suara iklan gak sinkron dengan suara podcast nya. Suara iklan lebih keras. Jadi kaget dan repot naik turunin volume,0,0,0,suara iklan gak sinkron dengan suara podcast nya. suara iklan lebih keras. jadi kaget dan repot naik turunin volume,suara iklan gak sinkron dengan suara podcast nya suara iklan lebih keras jadi kaget dan repot naik turunin volume,suara iklan gak sinkron dengan suara podcast nya suara iklan lebih keras jadi kaget dan repot naik turunin volume,suara iklan gak sinkron suara podcast nya suara iklan keras kaget repot turunin volume,suara iklan enggak sinkron suara podcast nya suara iklan keras kaget repot turunin volume,"['suara', 'iklan', 'enggak', 'sinkron', 'suara', 'podcast', 'nya', 'suara', 'iklan', 'keras', 'kaget', 'repot', 'turunin', 'volume']"
556,Ini gimana si kak.. setelah apdet kalo layar terkunci kok mati ya noice.. gak kayak dulu.. mohon segera diperbaiki,0,-1,0,ini gimana si kak.. setelah apdet kalo layar terkunci kok mati ya noice.. gak kayak dulu.. mohon segera diperbaiki,ini gimana si kak setelah apdet kalo layar terkunci kok mati ya noice gak kayak dulu mohon segera diperbaiki,ini gimana si kak setelah apdet kalo layar terkunci kok mati ya noice gak kayak dulu mohon segera diperbaiki,gimana si kak apdet kalo layar terkunci mati ya noice gak kayak mohon diperbaiki,bagaimana sih kak apdet kalo layar terkunci mati ya noice enggak kayak mohon diperbaiki,"['bagaimana', 'sih', 'kak', 'apdet', 'kalo', 'layar', 'terkunci', 'mati', 'ya', 'noice', 'enggak', 'kayak', 'mohon', 'diperbaiki']"
557,Apalah aplikasi ini malah bikin keder...!! Tiap habis download pasti dihapus gegara mau buka channel yg di inginkan ngga bisa2!?? ğŸ˜¤ Mendingan lihat noice di yutup aja daahh!!! ğŸ˜¤ğŸ˜¤ğŸ˜¤,0,-1,0,apalah aplikasi ini malah bikin keder...!! tiap habis download pasti dihapus gegara mau buka channel yg di inginkan ngga bisa2!?? ğŸ˜¤ mendingan lihat noice di yutup aja daahh!!! ğŸ˜¤ğŸ˜¤ğŸ˜¤,apalah aplikasi ini malah bikin keder tiap habis download pasti dihapus gegara mau buka channel yg di inginkan ngga bisa2  mendingan lihat noice di yutup aja daahh ,apalah aplikasi ini malah bikin keder tiap habis download pasti dihapus gegara mau buka channel yg di inginkan ngga bisa2  mendingan lihat noice di yutup aja daahh,apalah aplikasi bikin keder habis download dihapus gegara buka channel yg ngga bisa2 mendingan lihat noice yutup aja daahh,apalah aplikasi bikin keder habis download dihapus gegara buka channel yang enggak bisa2 mendingan lihat noice yutup saja daahh,"['apalah', 'aplikasi', 'bikin', 'keder', 'habis', 'download', 'dihapus', 'gegara', 'buka', 'channel', 'yang', 'enggak', 'bisa2', 'mendingan', 'lihat', 'noice', 'yutup', 'saja', 'daahh']"
558,Kirain ada vidionya juga ternyata cuma suara,0,0,0,kirain ada vidionya juga ternyata cuma suara,kirain ada vidionya juga ternyata cuma suara,kirain ada vidionya juga ternyata cuma suara,kirain vidionya suara,mengira vidionya suara,"['mengira', 'vidionya', 'suara']"
559,Min kok gwa gk bisa download pake data,0,-1,0,min kok gwa gk bisa download pake data,min kok gwa gk bisa download pake data,min kok gwa gk bisa download pake data,min gwa gk download pake data,min gwa enggak download pakai data,"['min', 'gwa', 'enggak', 'download', 'pakai', 'data']"
560,â£â–â–â–â–â–â¬œï¸â¬œï¸ â–â–â–â–â–â¬œï¸â¬œï¸â¬œï¸ â–â–â–â–â–â¬œï¸â¬œï¸â¬œï¸â¬œï¸ â–â–â–â–â–â¬œï¸â¬œï¸ğŸŸ§ğŸŸ§ â–â–â–â–â–â¬œï¸ğŸŸ§ â–â–â–â–â–â¬œï¸ğŸŸ¥ â–â¬œï¸â¬œï¸â¬œï¸â–â¬œï¸ğŸŸ¥ â¬œï¸â¬œï¸ğŸŸ§ğŸŸ¥â–â¬œï¸ğŸŸ¥ â¬œï¸ğŸŸ¥â–â–â–â¬œï¸ğŸŸ¥ â¬œï¸â¬œï¸â–â–â¬œï¸â¬œï¸ğŸŸ¥ â¬œï¸â¬œï¸â¬œï¸â¬œï¸â¬œï¸ğŸŸ§ â–â¬œï¸â¬œï¸ğŸŸ¥ğŸŸ§,0,0,0,â£â–â–â–â–â–â¬œï¸â¬œï¸ â–â–â–â–â–â¬œï¸â¬œï¸â¬œï¸ â–â–â–â–â–â¬œï¸â¬œï¸â¬œï¸â¬œï¸ â–â–â–â–â–â¬œï¸â¬œï¸ğŸŸ§ğŸŸ§ â–â–â–â–â–â¬œï¸ğŸŸ§ â–â–â–â–â–â¬œï¸ğŸŸ¥ â–â¬œï¸â¬œï¸â¬œï¸â–â¬œï¸ğŸŸ¥ â¬œï¸â¬œï¸ğŸŸ§ğŸŸ¥â–â¬œï¸ğŸŸ¥ â¬œï¸ğŸŸ¥â–â–â–â¬œï¸ğŸŸ¥ â¬œï¸â¬œï¸â–â–â¬œï¸â¬œï¸ğŸŸ¥ â¬œï¸â¬œï¸â¬œï¸â¬œï¸â¬œï¸ğŸŸ§ â–â¬œï¸â¬œï¸ğŸŸ¥ğŸŸ§,           ,,,,[]
561,noice aplikasi podscast terbaik apalagi ada debat ABDUR & MAMAT makin tambah seruğŸ’£ğŸ’£ğŸ’£,0,0,0,noice aplikasi podscast terbaik apalagi ada debat abdur & mamat makin tambah seruğŸ’£ğŸ’£ğŸ’£,noice aplikasi podscast terbaik apalagi ada debat abdur  mamat makin tambah seru,noice aplikasi podscast terbaik apalagi ada debat abdur  mamat makin tambah seru,noice aplikasi podscast terbaik debat abdur mamat seru,noice aplikasi podscast terbaik debat abdur mamat seru,"['noice', 'aplikasi', 'podscast', 'terbaik', 'debat', 'abdur', 'mamat', 'seru']"
562,"Bagus, sudah download dari musuh masyarakat season 1 sampe sekarang",0,0,0,"bagus, sudah download dari musuh masyarakat season 1 sampe sekarang",bagus sudah download dari musuh masyarakat season 1 sampe sekarang,bagus sudah download dari musuh masyarakat season 1 sampe sekarang,bagus download musuh masyarakat season 1 sampe,bagus download musuh masyarakat season 1 sampai,"['bagus', 'download', 'musuh', 'masyarakat', 'season', '1', 'sampai']"
563,"Sebenernya apk nya bagus, cuma pas lagi asik dengerin malah Stop gara gara jaringan lag. Padahal apk lain gaada yang lag, Tolong dong di cek koneksi nya. Bikin jengkel aja",0,0,-1,"sebenernya apk nya bagus, cuma pas lagi asik dengerin malah stop gara gara jaringan lag. padahal apk lain gaada yang lag, tolong dong di cek koneksi nya. bikin jengkel aja",sebenernya apk nya bagus cuma pas lagi asik dengerin malah stop gara gara jaringan lag padahal apk lain gaada yang lag tolong dong di cek koneksi nya bikin jengkel aja,sebenernya apk nya bagus cuma pas lagi asik dengerin malah stop gara gara jaringan lag padahal apk lain gaada yang lag tolong dong di cek koneksi nya bikin jengkel aja,sebenernya apk nya bagus pas asik dengerin stop gara gara jaringan lag apk gaada lag tolong cek koneksi nya bikin jengkel aja,sebenarnya aplikasi nya bagus pas asik dengarkan stop gara gara jaringan lag aplikasi enggak ada lag tolong cek koneksi nya bikin jengkel saja,"['sebenarnya', 'aplikasi', 'nya', 'bagus', 'pas', 'asik', 'dengarkan', 'stop', 'gara', 'gara', 'jaringan', 'lag', 'aplikasi', 'enggak', 'ada', 'lag', 'tolong', 'cek', 'koneksi', 'nya', 'bikin', 'jengkel', 'saja']"
564,Kan bener mulai berbayar. Heeiii saya download noice krn musmas dan sekarang malah vip. Uninstall noice dan otw reuploader yutup dan saya tidak peduli.,0,0,0,kan bener mulai berbayar. heeiii saya download noice krn musmas dan sekarang malah vip. uninstall noice dan otw reuploader yutup dan saya tidak peduli.,kan bener mulai berbayar heeiii saya download noice krn musmas dan sekarang malah vip uninstall noice dan otw reuploader yutup dan saya tidak peduli,kan bener mulai berbayar heeiii saya download noice krn musmas dan sekarang malah vip uninstall noice dan otw reuploader yutup dan saya tidak peduli,bener berbayar heeiii download noice krn musmas vip uninstall noice otw reuploader yutup tidak peduli,benar berbayar heeiii download noice karena musmas vip uninstall noice otw reuploader yutup tidak peduli,"['benar', 'berbayar', 'heeiii', 'download', 'noice', 'karena', 'musmas', 'vip', 'uninstall', 'noice', 'otw', 'reuploader', 'yutup', 'tidak', 'peduli']"
565,"Kenapa force close terus pas dibuka, sudah update ke versi terbaru padahal",0,0,-1,"kenapa force close terus pas dibuka, sudah update ke versi terbaru padahal",kenapa force close terus pas dibuka sudah update ke versi terbaru padahal,kenapa force close terus pas dibuka sudah update ke versi terbaru padahal,force close pas dibuka update versi terbaru,force close pas dibuka update versi terbaru,"['force', 'close', 'pas', 'dibuka', 'update', 'versi', 'terbaru']"
566,Beli konten VIP tapi kontennya dihapus ğŸ¤£ makin lawak nih noice,0,0,0,beli konten vip tapi kontennya dihapus ğŸ¤£ makin lawak nih noice,beli konten vip tapi kontennya dihapus  makin lawak nih noice,beli konten vip tapi kontennya dihapus  makin lawak nih noice,beli konten vip kontennya dihapus lawak nih noice,beli konten vip kontennya dihapus lawak nih noice,"['beli', 'konten', 'vip', 'kontennya', 'dihapus', 'lawak', 'nih', 'noice']"
567,"Iseng download noice gara-gara YouT*be yang makin hari makin ga relevan, ternyata interest juga sama konten noise terutama ""Onad Hesti"" tapi sayangnya udah ga perpanjang. Tolong dong lebih reguler lagi kalo bisa tiap hari biar ga bosen nunggu",0,0,0,"iseng download noice gara-gara yout*be yang makin hari makin ga relevan, ternyata interest juga sama konten noise terutama ""onad hesti"" tapi sayangnya udah ga perpanjang. tolong dong lebih reguler lagi kalo bisa tiap hari biar ga bosen nunggu",iseng download noice garagara youtbe yang makin hari makin ga relevan ternyata interest juga sama konten noise terutama onad hesti tapi sayangnya udah ga perpanjang tolong dong lebih reguler lagi kalo bisa tiap hari biar ga bosen nunggu,iseng download noice garagara youtbe yang makin hari makin ga relevan ternyata interest juga sama konten noise terutama onad hesti tapi sayangnya udah ga perpanjang tolong dong lebih reguler lagi kalo bisa tiap hari biar ga bosen nunggu,iseng download noice garagara youtbe ga relevan interest konten noise onad hesti sayangnya udah ga perpanjang tolong reguler kalo biar ga bosen nunggu,iseng download noice garagara youtbe enggak relevan interest konten noise onad hesti sayangnya sudah enggak perpanjang tolong reguler kalo biar enggak bosan nunggu,"['iseng', 'download', 'noice', 'garagara', 'youtbe', 'enggak', 'relevan', 'interest', 'konten', 'noise', 'onad', 'hesti', 'sayangnya', 'sudah', 'enggak', 'perpanjang', 'tolong', 'reguler', 'kalo', 'biar', 'enggak', 'bosan', 'nunggu']"
568,"oke, cukup membuat saya pulas tidurnya",0,0,0,"oke, cukup membuat saya pulas tidurnya",oke cukup membuat saya pulas tidurnya,oke cukup membuat saya pulas tidurnya,oke pulas tidurnya,oke pulas tidurnya,"['oke', 'pulas', 'tidurnya']"
569,Nge bug mulu tiap mau masuk malah force close,0,0,-1,nge bug mulu tiap mau masuk malah force close,nge bug mulu tiap mau masuk malah force close,nge bug mulu tiap mau masuk malah force close,nge bug mulu masuk force close,nge bug mulu masuk force close,"['nge', 'bug', 'mulu', 'masuk', 'force', 'close']"
570,"setalah update ke andorid 13, udah gak ada lagi untuk maju atau mundurin di notif",-1,0,0,"setalah update ke andorid 13, udah gak ada lagi untuk maju atau mundurin di notif",setalah update ke andorid 13 udah gak ada lagi untuk maju atau mundurin di notif,setalah update ke andorid 13 udah gak ada lagi untuk maju atau mundurin di notif,setalah update andorid 13 udah gak maju mundurin notif,setalah update andorid 13 sudah enggak maju mundurin notif,"['setalah', 'update', 'andorid', '13', 'sudah', 'enggak', 'maju', 'mundurin', 'notif']"
571,Tolong kembalikan musuh masyarakat seperti season 1-3 VIP pun tidak masalah,0,0,0,tolong kembalikan musuh masyarakat seperti season 1-3 vip pun tidak masalah,tolong kembalikan musuh masyarakat seperti season 13 vip pun tidak masalah,tolong kembalikan musuh masyarakat seperti season 13 vip pun tidak masalah,tolong kembalikan musuh masyarakat season 13 vip tidak,tolong kembalikan musuh masyarakat season 13 vip tidak,"['tolong', 'kembalikan', 'musuh', 'masyarakat', 'season', '13', 'vip', 'tidak']"
572,"banyak iklan, trus apa itu vip wkwkwk",0,0,0,"banyak iklan, trus apa itu vip wkwkwk",banyak iklan trus apa itu vip wkwkwk,banyak iklan trus apa itu vip wkwkwk,iklan trus vip wkwkwk,iklan terus vip wkwkwk,"['iklan', 'terus', 'vip', 'wkwkwk']"
573,"Untuk masa penarikan diamond tolong di percepat, sudah lewat 5 hari tapi dana tak kunjung masuk ke rekening",0,-1,0,"untuk masa penarikan diamond tolong di percepat, sudah lewat 5 hari tapi dana tak kunjung masuk ke rekening",untuk masa penarikan diamond tolong di percepat sudah lewat 5 hari tapi dana tak kunjung masuk ke rekening,untuk masa penarikan diamond tolong di percepat sudah lewat 5 hari tapi dana tak kunjung masuk ke rekening,penarikan diamond tolong percepat 5 dana kunjung masuk rekening,penarikan diamond tolong percepat 5 dana kunjung masuk rekening,"['penarikan', 'diamond', 'tolong', 'percepat', '5', 'dana', 'kunjung', 'masuk', 'rekening']"
574,"Install noice cma mw dngerin MUSUH MASYARAKAT. Dulu sih oke smpai ane rekomendasi Sma teman"" buat install NOICE , tpi sekrg udh pkek koin VIP dan isi.a sprti dngerin jokes bpak"" yg Lg ronda Ciiaaaaaaaaa",0,0,0,"install noice cma mw dngerin musuh masyarakat. dulu sih oke smpai ane rekomendasi sma teman"" buat install noice , tpi sekrg udh pkek koin vip dan isi.a sprti dngerin jokes bpak"" yg lg ronda ciiaaaaaaaaa",install noice cma mw dngerin musuh masyarakat dulu sih oke smpai ane rekomendasi sma teman buat install noice  tpi sekrg udh pkek koin vip dan isia sprti dngerin jokes bpak yg lg ronda ciiaaaaaaaaa,install noice cma mw dngerin musuh masyarakat dulu sih oke smpai ane rekomendasi sma teman buat install noice  tpi sekrg udh pkek koin vip dan isia sprti dngerin jokes bpak yg lg ronda ciiaaaaaaaaa,install noice cma mw dngerin musuh masyarakat sih oke smpai ane rekomendasi sma teman install noice tpi sekrg udh pkek koin vip isia sprti dngerin jokes bpak yg lg ronda ciiaaaaaaaaa,install noice cuma mau dngerin musuh masyarakat sih oke sampai ane rekomendasi sama teman install noice tapi sekrg sudah pakai koin vip isia seperti dngerin jokes bpak yang lagi ronda ciiaaaaaaaaa,"['install', 'noice', 'cuma', 'mau', 'dngerin', 'musuh', 'masyarakat', 'sih', 'oke', 'sampai', 'ane', 'rekomendasi', 'sama', 'teman', 'install', 'noice', 'tapi', 'sekrg', 'sudah', 'pakai', 'koin', 'vip', 'isia', 'seperti', 'dngerin', 'jokes', 'bpak', 'yang', 'lagi', 'ronda', 'ciiaaaaaaaaa']"
575,noice makin keren dan mulai diisi dengan berbagai media konten. Good job NoiceğŸ”¥,0,0,0,noice makin keren dan mulai diisi dengan berbagai media konten. good job noiceğŸ”¥,noice makin keren dan mulai diisi dengan berbagai media konten good job noice,noice makin keren dan mulai diisi dengan berbagai media konten good job noice,noice keren diisi media konten good job noice,noice keren diisi media konten good job noice,"['noice', 'keren', 'diisi', 'media', 'konten', 'good', 'job', 'noice']"
576,"Dengerin cerita hororr disini emang seru banget,cepet download dan support noice terus!",0,0,0,"dengerin cerita hororr disini emang seru banget,cepet download dan support noice terus!",dengerin cerita hororr disini emang seru bangetcepet download dan support noice terus,dengerin cerita hororr disini emang seru bangetcepet download dan support noice terus,dengerin cerita hororr emang seru bangetcepet download support noice,dengarkan cerita hororr memang seru bangetcepet download support noice,"['dengarkan', 'cerita', 'hororr', 'memang', 'seru', 'bangetcepet', 'download', 'support', 'noice']"
577,Yg bilang aplikasi berhenti sendiri.. Hape kalian kentang itu,0,0,1,yg bilang aplikasi berhenti sendiri.. hape kalian kentang itu,yg bilang aplikasi berhenti sendiri hape kalian kentang itu,yg bilang aplikasi berhenti sendiri hape kalian kentang itu,yg bilang aplikasi berhenti hape kentang,yang bilang aplikasi berhenti hape kentang,"['yang', 'bilang', 'aplikasi', 'berhenti', 'hape', 'kentang']"
578,Di device samsung sering banget crash appnya,0,0,-1,di device samsung sering banget crash appnya,di device samsung sering banget crash appnya,di device samsung sering banget crash appnya,device samsung banget crash appnya,device samsung banget crash appnya,"['device', 'samsung', 'banget', 'crash', 'appnya']"
579,"5 bintang nya dong,, sekeren ini",0,0,0,"5 bintang nya dong,, sekeren ini",5 bintang nya dong sekeren ini,5 bintang nya dong sekeren ini,5 bintang nya sekeren,5 bintang nya sekeren,"['5', 'bintang', 'nya', 'sekeren']"
580,sekarang kalau download menunggu mulu min,0,0,0,sekarang kalau download menunggu mulu min,sekarang kalau download menunggu mulu min,sekarang kalau download menunggu mulu min,download menunggu mulu min,download menunggu mulu min,"['download', 'menunggu', 'mulu', 'min']"
