,user_review,pengalaman visual,fungsi,performa dan stabilitas,case_fold,remove_punctuation,remove_whitespace,stopword_removal,normalize,tokenize
0,Crash terus. Ngga bisa didengerin sambil buka aplikasi lain. Ngga se-smooth Spotify. Jadi harus buka ulang aplikasinya.,0,-1,-1,crash terus. ngga bisa didengerin sambil buka aplikasi lain. ngga se-smooth spotify. jadi harus buka ulang aplikasinya.,crash terus ngga bisa didengerin sambil buka aplikasi lain ngga sesmooth spotify jadi harus buka ulang aplikasinya,crash terus ngga bisa didengerin sambil buka aplikasi lain ngga sesmooth spotify jadi harus buka ulang aplikasinya,crash ngga didengerin buka aplikasi ngga sesmooth spotify buka ulang aplikasinya,crash enggak didengerin buka aplikasi enggak sesmooth spotify buka ulang aplikasinya,"['crash', 'enggak', 'didengerin', 'buka', 'aplikasi', 'enggak', 'sesmooth', 'spotify', 'buka', 'ulang', 'aplikasinya']"
1,Kok loading nya lama yaa sampe Berjam jam di tunggu nga bisa padahal jaringannya bagus.,0,0,-1,kok loading nya lama yaa sampe berjam jam di tunggu nga bisa padahal jaringannya bagus.,kok loading nya lama yaa sampe berjam jam di tunggu nga bisa padahal jaringannya bagus,kok loading nya lama yaa sampe berjam jam di tunggu nga bisa padahal jaringannya bagus,loading nya yaa sampe berjam jam tunggu nga jaringannya bagus,loading nya ya sampai berjam jam tunggu enggak jaringannya bagus,"['loading', 'nya', 'ya', 'sampai', 'berjam', 'jam', 'tunggu', 'enggak', 'jaringannya', 'bagus']"
2,"Sering tiba2 mati sendiri, diputar lagi ngulang lagi dari awal",0,-1,-1,"sering tiba2 mati sendiri, diputar lagi ngulang lagi dari awal",sering tiba2 mati sendiri diputar lagi ngulang lagi dari awal,sering tiba2 mati sendiri diputar lagi ngulang lagi dari awal,tiba2 mati diputar ngulang,tiba-tiba mati diputar ngulang,"['tiba-tiba', 'mati', 'diputar', 'ngulang']"
3,"playing downloadnya ngebug mulu, play di playlistnya kadang ga work atau ga sesuai urutan",0,-1,-1,"playing downloadnya ngebug mulu, play di playlistnya kadang ga work atau ga sesuai urutan",playing downloadnya ngebug mulu play di playlistnya kadang ga work atau ga sesuai urutan,playing downloadnya ngebug mulu play di playlistnya kadang ga work atau ga sesuai urutan,playing downloadnya ngebug mulu play playlistnya kadang ga work ga sesuai urutan,playing downloadnya ngebug mulu play playlistnya kadang enggak work enggak sesuai urutan,"['playing', 'downloadnya', 'ngebug', 'mulu', 'play', 'playlistnya', 'kadang', 'enggak', 'work', 'enggak', 'sesuai', 'urutan']"
4,Eror audio podcast ga bisa di putar di device Samsung di realme bisa,0,-1,-1,eror audio podcast ga bisa di putar di device samsung di realme bisa,eror audio podcast ga bisa di putar di device samsung di realme bisa,eror audio podcast ga bisa di putar di device samsung di realme bisa,eror audio podcast ga putar device samsung realme,eror audio podcast enggak putar device samsung realme,"['eror', 'audio', 'podcast', 'enggak', 'putar', 'device', 'samsung', 'realme']"
5,Apliaksi keren bisa dengerin radio tanpa hendset pokonya the best noice,0,1,0,apliaksi keren bisa dengerin radio tanpa hendset pokonya the best noice,apliaksi keren bisa dengerin radio tanpa hendset pokonya the best noice,apliaksi keren bisa dengerin radio tanpa hendset pokonya the best noice,apliaksi keren dengerin radio hendset pokonya the best noice,apliaksi keren dengarkan radio hendset pokoknya the best noice,"['apliaksi', 'keren', 'dengarkan', 'radio', 'hendset', 'pokoknya', 'the', 'best', 'noice']"
6,bagus banget apalagi dengerin horor sambil perjalanan pulang,0,0,0,bagus banget apalagi dengerin horor sambil perjalanan pulang,bagus banget apalagi dengerin horor sambil perjalanan pulang,bagus banget apalagi dengerin horor sambil perjalanan pulang,bagus banget dengerin horor perjalanan pulang,bagus banget dengarkan horor perjalanan pulang,"['bagus', 'banget', 'dengarkan', 'horor', 'perjalanan', 'pulang']"
7,"Akhirnya menemukan cs noice yang sigap dan membantu saya dalam menjawab pertanyaan, good job noice",0,0,0,"akhirnya menemukan cs noice yang sigap dan membantu saya dalam menjawab pertanyaan, good job noice",akhirnya menemukan cs noice yang sigap dan membantu saya dalam menjawab pertanyaan good job noice,akhirnya menemukan cs noice yang sigap dan membantu saya dalam menjawab pertanyaan good job noice,menemukan cs noice sigap membantu good job noice,menemukan cs noice sigap membantu good job noice,"['menemukan', 'cs', 'noice', 'sigap', 'membantu', 'good', 'job', 'noice']"
8,gabisa diputar mau pake wifi atau data sekalipun ini podcast kenapa ya?,0,-1,0,gabisa diputar mau pake wifi atau data sekalipun ini podcast kenapa ya?,gabisa diputar mau pake wifi atau data sekalipun ini podcast kenapa ya,gabisa diputar mau pake wifi atau data sekalipun ini podcast kenapa ya,gabisa diputar pake wifi data podcast ya,enggak bisa diputar pakai wifi data podcast ya,"['enggak', 'bisa', 'diputar', 'pakai', 'wifi', 'data', 'podcast', 'ya']"
9,Ehh sumpah deh Ni apk bagus banget buat dengerin podcast horor gitu,0,0,0,ehh sumpah deh ni apk bagus banget buat dengerin podcast horor gitu,ehh sumpah deh ni apk bagus banget buat dengerin podcast horor gitu,ehh sumpah deh ni apk bagus banget buat dengerin podcast horor gitu,ehh sumpah deh ni apk bagus banget dengerin podcast horor gitu,eh sumpah deh ini aplikasi bagus banget dengarkan podcast horor begitu,"['eh', 'sumpah', 'deh', 'ini', 'aplikasi', 'bagus', 'banget', 'dengarkan', 'podcast', 'horor', 'begitu']"
10,noice kepada aku liat podcast tiba-tiba ganti ke podcast yang lain,0,0,0,noice kepada aku liat podcast tiba-tiba ganti ke podcast yang lain,noice kepada aku liat podcast tibatiba ganti ke podcast yang lain,noice kepada aku liat podcast tibatiba ganti ke podcast yang lain,noice liat podcast tibatiba ganti podcast,noice lihat podcast tibatiba ganti podcast,"['noice', 'lihat', 'podcast', 'tibatiba', 'ganti', 'podcast']"
11,Kok aplikasi ini gk bisa live ya kok tulisan ada yang salah maksudnya gimana ya?,0,0,0,kok aplikasi ini gk bisa live ya kok tulisan ada yang salah maksudnya gimana ya?,kok aplikasi ini gk bisa live ya kok tulisan ada yang salah maksudnya gimana ya,kok aplikasi ini gk bisa live ya kok tulisan ada yang salah maksudnya gimana ya,aplikasi gk live ya tulisan salah maksudnya gimana ya,aplikasi enggak live ya tulisan salah maksudnya bagaimana ya,"['aplikasi', 'enggak', 'live', 'ya', 'tulisan', 'salah', 'maksudnya', 'bagaimana', 'ya']"
12,"Gua udah lumayan lama denger podcast di aplikasi ini aplikasinya bagus lah, cuman kadang-kadang suka ada bug atau apa kadang podcast yang udah di download suka hilang semua padahal udah download banyak,tolong dong di perbaiki soalnya suka bikin kesel ngedownload podcast biar pas gaada kuota bisa dengerin eh gak bisa di play jadi tolong di perbaiki",0,0,-1,"gua udah lumayan lama denger podcast di aplikasi ini aplikasinya bagus lah, cuman kadang-kadang suka ada bug atau apa kadang podcast yang udah di download suka hilang semua padahal udah download banyak,tolong dong di perbaiki soalnya suka bikin kesel ngedownload podcast biar pas gaada kuota bisa dengerin eh gak bisa di play jadi tolong di perbaiki",gua udah lumayan lama denger podcast di aplikasi ini aplikasinya bagus lah cuman kadangkadang suka ada bug atau apa kadang podcast yang udah di download suka hilang semua padahal udah download banyaktolong dong di perbaiki soalnya suka bikin kesel ngedownload podcast biar pas gaada kuota bisa dengerin eh gak bisa di play jadi tolong di perbaiki,gua udah lumayan lama denger podcast di aplikasi ini aplikasinya bagus lah cuman kadangkadang suka ada bug atau apa kadang podcast yang udah di download suka hilang semua padahal udah download banyaktolong dong di perbaiki soalnya suka bikin kesel ngedownload podcast biar pas gaada kuota bisa dengerin eh gak bisa di play jadi tolong di perbaiki,gua udah lumayan denger podcast aplikasi aplikasinya bagus cuman kadangkadang suka bug kadang podcast udah download suka hilang udah download banyaktolong perbaiki suka bikin kesel ngedownload podcast biar pas gaada kuota dengerin eh gak play tolong perbaiki,gua sudah lumayan dengar podcast aplikasi aplikasinya bagus cuman kadangkadang suka bug kadang podcast sudah download suka hilang sudah download banyaktolong perbaiki suka bikin kesel ngedownload podcast biar pas enggak ada kuota dengarkan eh enggak play tolong perbaiki,"['gua', 'sudah', 'lumayan', 'dengar', 'podcast', 'aplikasi', 'aplikasinya', 'bagus', 'cuman', 'kadangkadang', 'suka', 'bug', 'kadang', 'podcast', 'sudah', 'download', 'suka', 'hilang', 'sudah', 'download', 'banyaktolong', 'perbaiki', 'suka', 'bikin', 'kesel', 'ngedownload', 'podcast', 'biar', 'pas', 'enggak', 'ada', 'kuota', 'dengarkan', 'eh', 'enggak', 'play', 'tolong', 'perbaiki']"
13,"so far so good,tpi tolong dong yg playlist dari Abang"" stand up comedy panjangin kontraknya kayak pandeka, podcast kena mental terus yg lain"" soalnya sekarang pada politik semua dah ga seru!!!",0,0,0,"so far so good,tpi tolong dong yg playlist dari abang"" stand up comedy panjangin kontraknya kayak pandeka, podcast kena mental terus yg lain"" soalnya sekarang pada politik semua dah ga seru!!!",so far so goodtpi tolong dong yg playlist dari abang stand up comedy panjangin kontraknya kayak pandeka podcast kena mental terus yg lain soalnya sekarang pada politik semua dah ga seru,so far so goodtpi tolong dong yg playlist dari abang stand up comedy panjangin kontraknya kayak pandeka podcast kena mental terus yg lain soalnya sekarang pada politik semua dah ga seru,so far so goodtpi tolong yg playlist abang stand up comedy panjangin kontraknya kayak pandeka podcast kena mental yg politik dah ga seru,so far so goodtpi tolong yang playlist abang stand up comedy panjangin kontraknya kayak pandeka podcast kena mental yang politik deh enggak seru,"['so', 'far', 'so', 'goodtpi', 'tolong', 'yang', 'playlist', 'abang', 'stand', 'up', 'comedy', 'panjangin', 'kontraknya', 'kayak', 'pandeka', 'podcast', 'kena', 'mental', 'yang', 'politik', 'deh', 'enggak', 'seru']"
14,"Sdh ngk seru lagi, klu dulu masih seru",0,0,0,"sdh ngk seru lagi, klu dulu masih seru",sdh ngk seru lagi klu dulu masih seru,sdh ngk seru lagi klu dulu masih seru,sdh ngk seru klu seru,sudah enggak seru kalau seru,"['sudah', 'enggak', 'seru', 'kalau', 'seru']"
15,baik senang dgn dakwah islamyah,0,0,0,baik senang dgn dakwah islamyah,baik senang dgn dakwah islamyah,baik senang dgn dakwah islamyah,senang dgn dakwah islamyah,senang dengan dakwah islamyah,"['senang', 'dengan', 'dakwah', 'islamyah']"
16,Kecewa Hiduplah Indonesia Maya harus beli lagi walau sudah langganan noice premium,0,0,0,kecewa hiduplah indonesia maya harus beli lagi walau sudah langganan noice premium,kecewa hiduplah indonesia maya harus beli lagi walau sudah langganan noice premium,kecewa hiduplah indonesia maya harus beli lagi walau sudah langganan noice premium,kecewa hiduplah indonesia maya beli langganan noice premium,kecewa hiduplah indonesia maya beli langganan noice premium,"['kecewa', 'hiduplah', 'indonesia', 'maya', 'beli', 'langganan', 'noice', 'premium']"
17,"donlot ini cuma mau denger trio kurnia, tapi iklannya banyak bgt tiap mau muter audio ada iklan kalah sama spotify podcast",0,0,0,"donlot ini cuma mau denger trio kurnia, tapi iklannya banyak bgt tiap mau muter audio ada iklan kalah sama spotify podcast",donlot ini cuma mau denger trio kurnia tapi iklannya banyak bgt tiap mau muter audio ada iklan kalah sama spotify podcast,donlot ini cuma mau denger trio kurnia tapi iklannya banyak bgt tiap mau muter audio ada iklan kalah sama spotify podcast,donlot denger trio kurnia iklannya bgt muter audio iklan kalah spotify podcast,donlot dengar trio kurnia iklannya banget muter audio iklan kalah spotify podcast,"['donlot', 'dengar', 'trio', 'kurnia', 'iklannya', 'banget', 'muter', 'audio', 'iklan', 'kalah', 'spotify', 'podcast']"
18,"sampah, sinya full tapi ga bisa play bagusan spotify kemana mana",0,-1,0,"sampah, sinya full tapi ga bisa play bagusan spotify kemana mana",sampah sinya full tapi ga bisa play bagusan spotify kemana mana,sampah sinya full tapi ga bisa play bagusan spotify kemana mana,sampah sinya full ga play bagusan spotify kemana,sampah sinya full enggak play bagusan spotify kemana,"['sampah', 'sinya', 'full', 'enggak', 'play', 'bagusan', 'spotify', 'kemana']"
19,Aplikasi ya bagus tapi kalo donload episodenya ko lama banget tolong di perbaiki,0,0,-1,aplikasi ya bagus tapi kalo donload episodenya ko lama banget tolong di perbaiki,aplikasi ya bagus tapi kalo donload episodenya ko lama banget tolong di perbaiki,aplikasi ya bagus tapi kalo donload episodenya ko lama banget tolong di perbaiki,aplikasi ya bagus kalo donload episodenya ko banget tolong perbaiki,aplikasi ya bagus kalo donload episodenya kok banget tolong perbaiki,"['aplikasi', 'ya', 'bagus', 'kalo', 'donload', 'episodenya', 'kok', 'banget', 'tolong', 'perbaiki']"
20,"Makin kesini noice makin kapitalis dikit-dikit pakai duit, sudah berlangganan tetap aja ada konten pakai duit padahal bukan musuh masyarakat",0,0,0,"makin kesini noice makin kapitalis dikit-dikit pakai duit, sudah berlangganan tetap aja ada konten pakai duit padahal bukan musuh masyarakat",makin kesini noice makin kapitalis dikitdikit pakai duit sudah berlangganan tetap aja ada konten pakai duit padahal bukan musuh masyarakat,makin kesini noice makin kapitalis dikitdikit pakai duit sudah berlangganan tetap aja ada konten pakai duit padahal bukan musuh masyarakat,kesini noice kapitalis dikitdikit pakai duit berlangganan aja konten pakai duit musuh masyarakat,kesini noice kapitalis dikitdikit pakai duit berlangganan saja konten pakai duit musuh masyarakat,"['kesini', 'noice', 'kapitalis', 'dikitdikit', 'pakai', 'duit', 'berlangganan', 'saja', 'konten', 'pakai', 'duit', 'musuh', 'masyarakat']"
21,"Aplikasi nya sering lag, dan saat menyalakan radio sering tidak berjalan",0,-1,-1,"aplikasi nya sering lag, dan saat menyalakan radio sering tidak berjalan",aplikasi nya sering lag dan saat menyalakan radio sering tidak berjalan,aplikasi nya sering lag dan saat menyalakan radio sering tidak berjalan,aplikasi nya lag menyalakan radio tidak berjalan,aplikasi nya lag menyalakan radio tidak berjalan,"['aplikasi', 'nya', 'lag', 'menyalakan', 'radio', 'tidak', 'berjalan']"
22,gabisa play. wifi full tetep gamau nyambung muter doang,0,-1,-1,gabisa play. wifi full tetep gamau nyambung muter doang,gabisa play wifi full tetep gamau nyambung muter doang,gabisa play wifi full tetep gamau nyambung muter doang,gabisa play wifi full tetep gamau nyambung muter doang,enggak bisa play wifi full tetap enggak mau menyambung muter doang,"['enggak', 'bisa', 'play', 'wifi', 'full', 'tetap', 'enggak', 'mau', 'menyambung', 'muter', 'doang']"
23,"selagi musmas terus jalan, w kasih bintang 5",0,0,0,"selagi musmas terus jalan, w kasih bintang 5",selagi musmas terus jalan w kasih bintang 5,selagi musmas terus jalan w kasih bintang 5,selagi musmas jalan w kasih bintang 5,selagi musmas jalan gue kasih bintang 5,"['selagi', 'musmas', 'jalan', 'gue', 'kasih', 'bintang', '5']"
24,"Aku mau podcasternya yang bersuara seksi seperti semua pengisi suara ""batman bangkit"" Di spoti**** tolong",0,0,0,"aku mau podcasternya yang bersuara seksi seperti semua pengisi suara ""batman bangkit"" di spoti**** tolong",aku mau podcasternya yang bersuara seksi seperti semua pengisi suara batman bangkit di spoti tolong,aku mau podcasternya yang bersuara seksi seperti semua pengisi suara batman bangkit di spoti tolong,podcasternya bersuara seksi pengisi suara batman bangkit spoti tolong,podcasternya bersuara seksi pengisi suara batman bangkit spoti tolong,"['podcasternya', 'bersuara', 'seksi', 'pengisi', 'suara', 'batman', 'bangkit', 'spoti', 'tolong']"
25,"Ini kenapa aplikasi nya yang udah didengarkan, dihari lain jadi ga bisa didengarkan lagi. Kalian bilang free kapanpun, kenapa malah ga bisa.",0,-1,0,"ini kenapa aplikasi nya yang udah didengarkan, dihari lain jadi ga bisa didengarkan lagi. kalian bilang free kapanpun, kenapa malah ga bisa.",ini kenapa aplikasi nya yang udah didengarkan dihari lain jadi ga bisa didengarkan lagi kalian bilang free kapanpun kenapa malah ga bisa,ini kenapa aplikasi nya yang udah didengarkan dihari lain jadi ga bisa didengarkan lagi kalian bilang free kapanpun kenapa malah ga bisa,aplikasi nya udah didengarkan dihari ga didengarkan bilang free ga,aplikasi nya sudah didengarkan dihari enggak didengarkan bilang free enggak,"['aplikasi', 'nya', 'sudah', 'didengarkan', 'dihari', 'enggak', 'didengarkan', 'bilang', 'free', 'enggak']"
26,"Kocak juga ini aplikasi.. Sudah subscribe bayar bulanan buat VIP, malah skrg ada beberapa konten VIP yg mesti diunlock lagi selain MUSMAS. Contoh hiduplah indonesia maya mulai sering VIP, butuh koin lagi. padahal kita udah subscribe VIP. Koplak deh. Udah dibayarin minta lebih terus. Bulan berikut males deh unlock VIP konten. Ga denger juga gapapa.",0,0,0,"kocak juga ini aplikasi.. sudah subscribe bayar bulanan buat vip, malah skrg ada beberapa konten vip yg mesti diunlock lagi selain musmas. contoh hiduplah indonesia maya mulai sering vip, butuh koin lagi. padahal kita udah subscribe vip. koplak deh. udah dibayarin minta lebih terus. bulan berikut males deh unlock vip konten. ga denger juga gapapa.",kocak juga ini aplikasi sudah subscribe bayar bulanan buat vip malah skrg ada beberapa konten vip yg mesti diunlock lagi selain musmas contoh hiduplah indonesia maya mulai sering vip butuh koin lagi padahal kita udah subscribe vip koplak deh udah dibayarin minta lebih terus bulan berikut males deh unlock vip konten ga denger juga gapapa,kocak juga ini aplikasi sudah subscribe bayar bulanan buat vip malah skrg ada beberapa konten vip yg mesti diunlock lagi selain musmas contoh hiduplah indonesia maya mulai sering vip butuh koin lagi padahal kita udah subscribe vip koplak deh udah dibayarin minta lebih terus bulan berikut males deh unlock vip konten ga denger juga gapapa,kocak aplikasi subscribe bayar bulanan vip skrg konten vip yg mesti diunlock musmas contoh hiduplah indonesia maya vip butuh koin udah subscribe vip koplak deh udah dibayarin males deh unlock vip konten ga denger gapapa,kocak aplikasi subscribe bayar bulanan vip sekarang konten vip yang mesti diunlock musmas contoh hiduplah indonesia maya vip butuh koin sudah subscribe vip kocak deh sudah dibayarin malas deh unlock vip konten enggak dengar gapapa,"['kocak', 'aplikasi', 'subscribe', 'bayar', 'bulanan', 'vip', 'sekarang', 'konten', 'vip', 'yang', 'mesti', 'diunlock', 'musmas', 'contoh', 'hiduplah', 'indonesia', 'maya', 'vip', 'butuh', 'koin', 'sudah', 'subscribe', 'vip', 'kocak', 'deh', 'sudah', 'dibayarin', 'malas', 'deh', 'unlock', 'vip', 'konten', 'enggak', 'dengar', 'gapapa']"
27,"ini kenapa ya, kok saya mau top up tapi ngga bisa terus pas pembayarannya? padahal kemarin"" lancar aja",0,0,-1,"ini kenapa ya, kok saya mau top up tapi ngga bisa terus pas pembayarannya? padahal kemarin"" lancar aja",ini kenapa ya kok saya mau top up tapi ngga bisa terus pas pembayarannya padahal kemarin lancar aja,ini kenapa ya kok saya mau top up tapi ngga bisa terus pas pembayarannya padahal kemarin lancar aja,ya top up ngga pas pembayarannya kemarin lancar aja,ya top up enggak pas pembayarannya kemarin lancar saja,"['ya', 'top', 'up', 'enggak', 'pas', 'pembayarannya', 'kemarin', 'lancar', 'saja']"
28,"Bagus apk nya, jika ada masalah pada apk nya mimin merespon dengan baik dan gercepğŸ‘",0,0,0,"bagus apk nya, jika ada masalah pada apk nya mimin merespon dengan baik dan gercepğŸ‘",bagus apk nya jika ada masalah pada apk nya mimin merespon dengan baik dan gercep,bagus apk nya jika ada masalah pada apk nya mimin merespon dengan baik dan gercep,bagus apk nya apk nya mimin merespon gercep,bagus aplikasi nya aplikasi nya admin merespon gercep,"['bagus', 'aplikasi', 'nya', 'aplikasi', 'nya', 'admin', 'merespon', 'gercep']"
29,Mohon perbaiki konten pada aplikasi bima+ dan myIM3 karena menampilkan konten yang sudah usang,0,0,0,mohon perbaiki konten pada aplikasi bima+ dan myim3 karena menampilkan konten yang sudah usang,mohon perbaiki konten pada aplikasi bima dan myim3 karena menampilkan konten yang sudah usang,mohon perbaiki konten pada aplikasi bima dan myim3 karena menampilkan konten yang sudah usang,mohon perbaiki konten aplikasi bima myim3 menampilkan konten usang,mohon perbaiki konten aplikasi bima myim3 menampilkan konten usang,"['mohon', 'perbaiki', 'konten', 'aplikasi', 'bima', 'myim3', 'menampilkan', 'konten', 'usang']"
30,bisa buat denger radio se Indonesia dan podcast anak bangsa,0,1,0,bisa buat denger radio se indonesia dan podcast anak bangsa,bisa buat denger radio se indonesia dan podcast anak bangsa,bisa buat denger radio se indonesia dan podcast anak bangsa,denger radio indonesia podcast anak bangsa,dengar radio indonesia podcast anak bangsa,"['dengar', 'radio', 'indonesia', 'podcast', 'anak', 'bangsa']"
31,Hot.93.2 fm dan hot.105 fm nirwana cintaku di prancis ajaib SIPIT dibuat mark ing women and ladies and jentelmen love me kiss yu love i am raden.m.sakaweuning,0,0,0,hot.93.2 fm dan hot.105 fm nirwana cintaku di prancis ajaib sipit dibuat mark ing women and ladies and jentelmen love me kiss yu love i am raden.m.sakaweuning,hot932 fm dan hot105 fm nirwana cintaku di prancis ajaib sipit dibuat mark ing women and ladies and jentelmen love me kiss yu love i am radenmsakaweuning,hot932 fm dan hot105 fm nirwana cintaku di prancis ajaib sipit dibuat mark ing women and ladies and jentelmen love me kiss yu love i am radenmsakaweuning,hot932 fm hot105 fm nirwana cintaku prancis ajaib sipit mark ing women and ladies and jentelmen love me kiss yu love i am radenmsakaweuning,hot932 fm hot105 fm nirwana cintaku prancis ajaib sipit mark ing women and ladies and jentelmen love me kiss yuk love i sama radenmsakaweuning,"['hot932', 'fm', 'hot105', 'fm', 'nirwana', 'cintaku', 'prancis', 'ajaib', 'sipit', 'mark', 'ing', 'women', 'and', 'ladies', 'and', 'jentelmen', 'love', 'me', 'kiss', 'yuk', 'love', 'i', 'sama', 'radenmsakaweuning']"
32,"Noice yang dulu bukan yang sekarang. Dulu kalau buka konten, pasti ada iklan. Sekarang pas buka channelnya aja udah masuk iklan. Konten yang mau dibuka udah di klik, tapi yang keputar malah konten lain di channel itu. Akhirnya kita perlu menunggu 2-4 iklan hanya untuk mengganti audio. Oke saya faham kalau iklan itu perlu. Tapi kok gini banget gitu. Jangan sampai mengorbankan kenyamanan user lah. Bukannya jumawa, tapi user bisa aja nyari platform yang lebih enak kalau Noice gini terus",0,0,0,"noice yang dulu bukan yang sekarang. dulu kalau buka konten, pasti ada iklan. sekarang pas buka channelnya aja udah masuk iklan. konten yang mau dibuka udah di klik, tapi yang keputar malah konten lain di channel itu. akhirnya kita perlu menunggu 2-4 iklan hanya untuk mengganti audio. oke saya faham kalau iklan itu perlu. tapi kok gini banget gitu. jangan sampai mengorbankan kenyamanan user lah. bukannya jumawa, tapi user bisa aja nyari platform yang lebih enak kalau noice gini terus",noice yang dulu bukan yang sekarang dulu kalau buka konten pasti ada iklan sekarang pas buka channelnya aja udah masuk iklan konten yang mau dibuka udah di klik tapi yang keputar malah konten lain di channel itu akhirnya kita perlu menunggu 24 iklan hanya untuk mengganti audio oke saya faham kalau iklan itu perlu tapi kok gini banget gitu jangan sampai mengorbankan kenyamanan user lah bukannya jumawa tapi user bisa aja nyari platform yang lebih enak kalau noice gini terus,noice yang dulu bukan yang sekarang dulu kalau buka konten pasti ada iklan sekarang pas buka channelnya aja udah masuk iklan konten yang mau dibuka udah di klik tapi yang keputar malah konten lain di channel itu akhirnya kita perlu menunggu 24 iklan hanya untuk mengganti audio oke saya faham kalau iklan itu perlu tapi kok gini banget gitu jangan sampai mengorbankan kenyamanan user lah bukannya jumawa tapi user bisa aja nyari platform yang lebih enak kalau noice gini terus,noice buka konten iklan pas buka channelnya aja udah masuk iklan konten dibuka udah klik keputar konten channel menunggu 24 iklan mengganti audio oke faham iklan gini banget gitu mengorbankan kenyamanan user jumawa user aja nyari platform enak noice gini,noice buka konten iklan pas buka channelnya saja sudah masuk iklan konten dibuka sudah klik keputar konten channel menunggu 24 iklan mengganti audio oke faham iklan begini banget begitu mengorbankan kenyamanan user jumawa user saja mencari platform enak noice begini,"['noice', 'buka', 'konten', 'iklan', 'pas', 'buka', 'channelnya', 'saja', 'sudah', 'masuk', 'iklan', 'konten', 'dibuka', 'sudah', 'klik', 'keputar', 'konten', 'channel', 'menunggu', '24', 'iklan', 'mengganti', 'audio', 'oke', 'faham', 'iklan', 'begini', 'banget', 'begitu', 'mengorbankan', 'kenyamanan', 'user', 'jumawa', 'user', 'saja', 'mencari', 'platform', 'enak', 'noice', 'begini']"
33,"hope so noice bs terus jaya, gak kalah ama youtube",0,0,0,"hope so noice bs terus jaya, gak kalah ama youtube",hope so noice bs terus jaya gak kalah ama youtube,hope so noice bs terus jaya gak kalah ama youtube,hope so noice bs jaya gak kalah ama youtube,hope so noice bisa jaya enggak kalah sama youtube,"['hope', 'so', 'noice', 'bisa', 'jaya', 'enggak', 'kalah', 'sama', 'youtube']"
34,gimana sih.. katanya selaim HIM dan musmas bisa semua pakai premium.. kok masih ada yg terkunci?,0,0,0,gimana sih.. katanya selaim him dan musmas bisa semua pakai premium.. kok masih ada yg terkunci?,gimana sih katanya selaim him dan musmas bisa semua pakai premium kok masih ada yg terkunci,gimana sih katanya selaim him dan musmas bisa semua pakai premium kok masih ada yg terkunci,gimana sih selaim him musmas pakai premium yg terkunci,bagaimana sih selaim him musmas pakai premium yang terkunci,"['bagaimana', 'sih', 'selaim', 'him', 'musmas', 'pakai', 'premium', 'yang', 'terkunci']"
