,user_review,pengalaman visual,fungsi,performa dan stabilitas,case_fold,remove_punctuation,remove_whitespace,stopword_removal,normalize,tokenize
260,"Lgi asik dngerin , sering x tiba"" trkluar sndri dan audio mati Pas mau dngerin lagi malah iklan , dan udh slsai iklan trkeluar lagi. Gtu aj trus",0,-1,-1,"lgi asik dngerin , sering x tiba"" trkluar sndri dan audio mati pas mau dngerin lagi malah iklan , dan udh slsai iklan trkeluar lagi. gtu aj trus",lgi asik dngerin  sering x tiba trkluar sndri dan audio mati pas mau dngerin lagi malah iklan  dan udh slsai iklan trkeluar lagi gtu aj trus,lgi asik dngerin  sering x tiba trkluar sndri dan audio mati pas mau dngerin lagi malah iklan  dan udh slsai iklan trkeluar lagi gtu aj trus,lgi asik dngerin x trkluar sndri audio mati pas dngerin iklan udh slsai iklan trkeluar gtu aj trus,lagi asik dngerin kali trkluar sendiri audio mati pas dngerin iklan sudah slsai iklan trkeluar begitu saja terus,"['lagi', 'asik', 'dngerin', 'kali', 'trkluar', 'sendiri', 'audio', 'mati', 'pas', 'dngerin', 'iklan', 'sudah', 'slsai', 'iklan', 'trkeluar', 'begitu', 'saja', 'terus']"
261,Kenapa di akun saya tidak bisa langganan bulanan lagi?,0,0,0,kenapa di akun saya tidak bisa langganan bulanan lagi?,kenapa di akun saya tidak bisa langganan bulanan lagi,kenapa di akun saya tidak bisa langganan bulanan lagi,akun tidak langganan bulanan,akun tidak langganan bulanan,"['akun', 'tidak', 'langganan', 'bulanan']"
262,"Bintang dinaikin karena udh dibaca, keluhan terbesar yaitu sering terjadi bug dan tiba2 berhenti, pas di nyalain lagi malah dibikin lebih bete lagi karena nungguin iklan setengah menit, hal kyk gini bikin bete bgt",0,0,-1,"bintang dinaikin karena udh dibaca, keluhan terbesar yaitu sering terjadi bug dan tiba2 berhenti, pas di nyalain lagi malah dibikin lebih bete lagi karena nungguin iklan setengah menit, hal kyk gini bikin bete bgt",bintang dinaikin karena udh dibaca keluhan terbesar yaitu sering terjadi bug dan tiba2 berhenti pas di nyalain lagi malah dibikin lebih bete lagi karena nungguin iklan setengah menit hal kyk gini bikin bete bgt,bintang dinaikin karena udh dibaca keluhan terbesar yaitu sering terjadi bug dan tiba2 berhenti pas di nyalain lagi malah dibikin lebih bete lagi karena nungguin iklan setengah menit hal kyk gini bikin bete bgt,bintang dinaikin udh dibaca keluhan terbesar bug tiba2 berhenti pas nyalain dibikin bete nungguin iklan menit kyk gini bikin bete bgt,bintang dinaikin sudah dibaca keluhan terbesar bug tiba-tiba berhenti pas nyalain dibikin bete menunggu iklan menit kayak begini bikin bete banget,"['bintang', 'dinaikin', 'sudah', 'dibaca', 'keluhan', 'terbesar', 'bug', 'tiba-tiba', 'berhenti', 'pas', 'nyalain', 'dibikin', 'bete', 'menunggu', 'iklan', 'menit', 'kayak', 'begini', 'bikin', 'bete', 'banget']"
263,Aplikasi nya bagus banyak cerita horor tapi kenapa film sudah di donwload gk bisa di putar anying kenapa bisa gk buang data emang aa ettdah negatif gua,0,-1,0,aplikasi nya bagus banyak cerita horor tapi kenapa film sudah di donwload gk bisa di putar anying kenapa bisa gk buang data emang aa ettdah negatif gua,aplikasi nya bagus banyak cerita horor tapi kenapa film sudah di donwload gk bisa di putar anying kenapa bisa gk buang data emang aa ettdah negatif gua,aplikasi nya bagus banyak cerita horor tapi kenapa film sudah di donwload gk bisa di putar anying kenapa bisa gk buang data emang aa ettdah negatif gua,aplikasi nya bagus cerita horor film donwload gk putar anying gk buang data emang aa ettdah negatif gua,aplikasi nya bagus cerita horor film donwload enggak putar anying enggak buang data memang aa ettdah negatif gua,"['aplikasi', 'nya', 'bagus', 'cerita', 'horor', 'film', 'donwload', 'enggak', 'putar', 'anying', 'enggak', 'buang', 'data', 'memang', 'aa', 'ettdah', 'negatif', 'gua']"
264,"Koq g bisa masuk ya,apa ada gangguan, tlng di jawab",0,0,-1,"koq g bisa masuk ya,apa ada gangguan, tlng di jawab",koq g bisa masuk yaapa ada gangguan tlng di jawab,koq g bisa masuk yaapa ada gangguan tlng di jawab,koq g masuk yaapa gangguan tlng,kok enggak masuk yaapa gangguan tlng,"['kok', 'enggak', 'masuk', 'yaapa', 'gangguan', 'tlng']"
265,bermanfaat sekali.. sambil mengerjakan sesuatu sambil menambah wawasan,0,0,0,bermanfaat sekali.. sambil mengerjakan sesuatu sambil menambah wawasan,bermanfaat sekali sambil mengerjakan sesuatu sambil menambah wawasan,bermanfaat sekali sambil mengerjakan sesuatu sambil menambah wawasan,bermanfaat menambah wawasan,bermanfaat menambah wawasan,"['bermanfaat', 'menambah', 'wawasan']"
266,"Ada bug di Noice ,pas play vidio podcast sering ke puter sendri layarnya",-1,0,0,"ada bug di noice ,pas play vidio podcast sering ke puter sendri layarnya",ada bug di noice pas play vidio podcast sering ke puter sendri layarnya,ada bug di noice pas play vidio podcast sering ke puter sendri layarnya,bug noice pas play vidio podcast puter sendri layarnya,bug noice pas play vidio podcast puter sendiri layarnya,"['bug', 'noice', 'pas', 'play', 'vidio', 'podcast', 'puter', 'sendiri', 'layarnya']"
267,Lihat subscribe nya jadi gak bisa,0,0,-1,lihat subscribe nya jadi gak bisa,lihat subscribe nya jadi gak bisa,lihat subscribe nya jadi gak bisa,lihat subscribe nya gak,lihat subscribe nya enggak,"['lihat', 'subscribe', 'nya', 'enggak']"
268,Cara hilangin overlay dibawah gimana ya? Terus cara ganti akun sebelah mana? Atau gabisa ganti akun?,0,0,0,cara hilangin overlay dibawah gimana ya? terus cara ganti akun sebelah mana? atau gabisa ganti akun?,cara hilangin overlay dibawah gimana ya terus cara ganti akun sebelah mana atau gabisa ganti akun,cara hilangin overlay dibawah gimana ya terus cara ganti akun sebelah mana atau gabisa ganti akun,hilangin overlay dibawah gimana ya ganti akun sebelah gabisa ganti akun,menghilangkan overlay dibawah bagaimana ya ganti akun sebelah enggak bisa ganti akun,"['menghilangkan', 'overlay', 'dibawah', 'bagaimana', 'ya', 'ganti', 'akun', 'sebelah', 'enggak', 'bisa', 'ganti', 'akun']"
269,Tempat paling asyik dan seru. Iklanya normal gak mengganggu ketika dengerin podcast.,0,1,0,tempat paling asyik dan seru. iklanya normal gak mengganggu ketika dengerin podcast.,tempat paling asyik dan seru iklanya normal gak mengganggu ketika dengerin podcast,tempat paling asyik dan seru iklanya normal gak mengganggu ketika dengerin podcast,asyik seru iklanya normal gak mengganggu dengerin podcast,asyik seru iklanya normal enggak mengganggu dengarkan podcast,"['asyik', 'seru', 'iklanya', 'normal', 'enggak', 'mengganggu', 'dengarkan', 'podcast']"
270,Iklannya suka ngebug tolong lah ganggu bgt!!!!,0,-1,0,iklannya suka ngebug tolong lah ganggu bgt!!!!,iklannya suka ngebug tolong lah ganggu bgt,iklannya suka ngebug tolong lah ganggu bgt,iklannya suka ngebug tolong ganggu bgt,iklannya suka ngebug tolong ganggu banget,"['iklannya', 'suka', 'ngebug', 'tolong', 'ganggu', 'banget']"
271,Kenapa setiap 5 menit mati kalau streaming podcast padahal jaringan lancar mohon di perbaiki .,0,-1,0,kenapa setiap 5 menit mati kalau streaming podcast padahal jaringan lancar mohon di perbaiki .,kenapa setiap 5 menit mati kalau streaming podcast padahal jaringan lancar mohon di perbaiki ,kenapa setiap 5 menit mati kalau streaming podcast padahal jaringan lancar mohon di perbaiki,5 menit mati streaming podcast jaringan lancar mohon perbaiki,5 menit mati streaming podcast jaringan lancar mohon perbaiki,"['5', 'menit', 'mati', 'streaming', 'podcast', 'jaringan', 'lancar', 'mohon', 'perbaiki']"
272,aplikasi lumayan untuk dengerin radio online,0,0,0,aplikasi lumayan untuk dengerin radio online,aplikasi lumayan untuk dengerin radio online,aplikasi lumayan untuk dengerin radio online,aplikasi lumayan dengerin radio online,aplikasi lumayan dengarkan radio online,"['aplikasi', 'lumayan', 'dengarkan', 'radio', 'online']"
273,enak buat kita gak bosen dengar nya karena banyak yang seru di dengar,0,0,0,enak buat kita gak bosen dengar nya karena banyak yang seru di dengar,enak buat kita gak bosen dengar nya karena banyak yang seru di dengar,enak buat kita gak bosen dengar nya karena banyak yang seru di dengar,enak gak bosen dengar nya seru dengar,enak enggak bosan dengar nya seru dengar,"['enak', 'enggak', 'bosan', 'dengar', 'nya', 'seru', 'dengar']"
274,Pake wifi gak mau muter,0,-1,0,pake wifi gak mau muter,pake wifi gak mau muter,pake wifi gak mau muter,pake wifi gak muter,pakai wifi enggak muter,"['pakai', 'wifi', 'enggak', 'muter']"
275,Opini Tengah Malam kok gak ada lagi ?,0,0,0,opini tengah malam kok gak ada lagi ?,opini tengah malam kok gak ada lagi ,opini tengah malam kok gak ada lagi,opini malam gak,opini malam enggak,"['opini', 'malam', 'enggak']"
276,"Gatau kenapa tadi sore dengerin Romance Dawn baru dapet setengah, iseng liat traffic paket data kok tiba"" 1,5GB. Ada apa ini, padahal cm mode suara gapake video",0,-1,0,"gatau kenapa tadi sore dengerin romance dawn baru dapet setengah, iseng liat traffic paket data kok tiba"" 1,5gb. ada apa ini, padahal cm mode suara gapake video",gatau kenapa tadi sore dengerin romance dawn baru dapet setengah iseng liat traffic paket data kok tiba 15gb ada apa ini padahal cm mode suara gapake video,gatau kenapa tadi sore dengerin romance dawn baru dapet setengah iseng liat traffic paket data kok tiba 15gb ada apa ini padahal cm mode suara gapake video,gatau sore dengerin romance dawn dapet iseng liat traffic paket data 15gb cm mode suara gapake video,enggak tau sore dengarkan romance dawn dapat iseng lihat traffic paket data 15gb cuma mode suara gapake video,"['enggak', 'tau', 'sore', 'dengarkan', 'romance', 'dawn', 'dapat', 'iseng', 'lihat', 'traffic', 'paket', 'data', '15gb', 'cuma', 'mode', 'suara', 'gapake', 'video']"
277,aplikasi tulil sinyal gua lancar tapi pas nge play malah macet-macet gajelas. emang paling bener denger podcast di ijo ajaa njinkkxxx,0,-1,0,aplikasi tulil sinyal gua lancar tapi pas nge play malah macet-macet gajelas. emang paling bener denger podcast di ijo ajaa njinkkxxx,aplikasi tulil sinyal gua lancar tapi pas nge play malah macetmacet gajelas emang paling bener denger podcast di ijo ajaa njinkkxxx,aplikasi tulil sinyal gua lancar tapi pas nge play malah macetmacet gajelas emang paling bener denger podcast di ijo ajaa njinkkxxx,aplikasi tulil sinyal gua lancar pas nge play macetmacet gajelas emang bener denger podcast ijo ajaa njinkkxxx,aplikasi tulil sinyal gua lancar pas nge play macetmacet enggak jelas memang benar dengar podcast ijo saja njinkkxxx,"['aplikasi', 'tulil', 'sinyal', 'gua', 'lancar', 'pas', 'nge', 'play', 'macetmacet', 'enggak', 'jelas', 'memang', 'benar', 'dengar', 'podcast', 'ijo', 'saja', 'njinkkxxx']"
278,Kurang suka sama cara iklan nya Noice. Ga bisa langsung atur waktu otomatis mati pas masih iklan,0,0,0,kurang suka sama cara iklan nya noice. ga bisa langsung atur waktu otomatis mati pas masih iklan,kurang suka sama cara iklan nya noice ga bisa langsung atur waktu otomatis mati pas masih iklan,kurang suka sama cara iklan nya noice ga bisa langsung atur waktu otomatis mati pas masih iklan,suka iklan nya noice ga langsung atur otomatis mati pas iklan,suka iklan nya noice enggak langsung atur otomatis mati pas iklan,"['suka', 'iklan', 'nya', 'noice', 'enggak', 'langsung', 'atur', 'otomatis', 'mati', 'pas', 'iklan']"
279,"dikit dikit iklan, ganggu bener asli",0,0,0,"dikit dikit iklan, ganggu bener asli",dikit dikit iklan ganggu bener asli,dikit dikit iklan ganggu bener asli,dikit dikit iklan ganggu bener asli,dikit dikit iklan ganggu benar asli,"['dikit', 'dikit', 'iklan', 'ganggu', 'benar', 'asli']"
280,"Hai Develop Noice, Ada kendala putar otomatis antar part di audiobook, baik antar judul dalam satu buku audiobook mampun sesama audiobook lainnya dalam menu antrean. Ini terjadi saat file audio di dengarkan saat live / on data internet. Coba di lagi, Semoga lebih baik Noice âœ…ğŸ˜‰",0,-1,0,"hai develop noice, ada kendala putar otomatis antar part di audiobook, baik antar judul dalam satu buku audiobook mampun sesama audiobook lainnya dalam menu antrean. ini terjadi saat file audio di dengarkan saat live / on data internet. coba di lagi, semoga lebih baik noice âœ…ğŸ˜‰",hai develop noice ada kendala putar otomatis antar part di audiobook baik antar judul dalam satu buku audiobook mampun sesama audiobook lainnya dalam menu antrean ini terjadi saat file audio di dengarkan saat live  on data internet coba di lagi semoga lebih baik noice ,hai develop noice ada kendala putar otomatis antar part di audiobook baik antar judul dalam satu buku audiobook mampun sesama audiobook lainnya dalam menu antrean ini terjadi saat file audio di dengarkan saat live  on data internet coba di lagi semoga lebih baik noice,hai develop noice kendala putar otomatis part audiobook judul buku audiobook mampun audiobook menu antrean file audio dengarkan live on data internet coba semoga noice,hai develop noice kendala putar otomatis part audiobook judul buku audiobook mampun audiobook menu antrean file audio dengarkan live on data internet coba semoga noice,"['hai', 'develop', 'noice', 'kendala', 'putar', 'otomatis', 'part', 'audiobook', 'judul', 'buku', 'audiobook', 'mampun', 'audiobook', 'menu', 'antrean', 'file', 'audio', 'dengarkan', 'live', 'on', 'data', 'internet', 'coba', 'semoga', 'noice']"
281,kalo bisa save data di sd lebih ok,0,0,0,kalo bisa save data di sd lebih ok,kalo bisa save data di sd lebih ok,kalo bisa save data di sd lebih ok,kalo save data sd ok,kalo save data sd ok,"['kalo', 'save', 'data', 'sd', 'ok']"
282,trio kurnia always in my heart,0,0,0,trio kurnia always in my heart,trio kurnia always in my heart,trio kurnia always in my heart,trio kurnia always in my heart,trio kurnia always ini my heart,"['trio', 'kurnia', 'always', 'ini', 'my', 'heart']"
283,"Kurangi durasi iklan, iklan 30 detik bisa muncul 2x",0,0,0,"kurangi durasi iklan, iklan 30 detik bisa muncul 2x",kurangi durasi iklan iklan 30 detik bisa muncul 2x,kurangi durasi iklan iklan 30 detik bisa muncul 2x,kurangi durasi iklan iklan 30 detik muncul 2x,kurangi durasi iklan iklan 30 detik muncul 2x,"['kurangi', 'durasi', 'iklan', 'iklan', '30', 'detik', 'muncul', '2x']"
284,bagus seru gak gabut kalo gak ada kuota,0,1,0,bagus seru gak gabut kalo gak ada kuota,bagus seru gak gabut kalo gak ada kuota,bagus seru gak gabut kalo gak ada kuota,bagus seru gak gabut kalo gak kuota,bagus seru enggak gabut kalo enggak kuota,"['bagus', 'seru', 'enggak', 'gabut', 'kalo', 'enggak', 'kuota']"
285,"Iklan nya makin lama cuyy.. lagi dengerin cerita pas pergantian, iklan.. bikin denger cerita ga tegang lagi",0,0,0,"iklan nya makin lama cuyy.. lagi dengerin cerita pas pergantian, iklan.. bikin denger cerita ga tegang lagi",iklan nya makin lama cuyy lagi dengerin cerita pas pergantian iklan bikin denger cerita ga tegang lagi,iklan nya makin lama cuyy lagi dengerin cerita pas pergantian iklan bikin denger cerita ga tegang lagi,iklan nya cuyy dengerin cerita pas pergantian iklan bikin denger cerita ga tegang,iklan nya cuy dengarkan cerita pas pergantian iklan bikin dengar cerita enggak tegang,"['iklan', 'nya', 'cuy', 'dengarkan', 'cerita', 'pas', 'pergantian', 'iklan', 'bikin', 'dengar', 'cerita', 'enggak', 'tegang']"
286,Udh download podcast tp pas dilihat didownload msh kosong,0,-1,0,udh download podcast tp pas dilihat didownload msh kosong,udh download podcast tp pas dilihat didownload msh kosong,udh download podcast tp pas dilihat didownload msh kosong,udh download podcast tp pas didownload msh kosong,sudah download podcast tapi pas didownload masih kosong,"['sudah', 'download', 'podcast', 'tapi', 'pas', 'didownload', 'masih', 'kosong']"
287,Bisakah ditambahkan fitur Widget ?,0,0,0,bisakah ditambahkan fitur widget ?,bisakah ditambahkan fitur widget ,bisakah ditambahkan fitur widget,fitur widget,fitur widget,"['fitur', 'widget']"
288,"OK PUNYA, KONTEN AUDIO YG KREATIF, & SATU DALAM SEMUA, BANYAK FITUR serta PADA SAAT BERPINDAH KONTEN__PEMUTARAN KONTEN YG MASIH BERJALAN MASIH BERLANGSUNG dalam Mode MINIMIZED.NAMUN ,ADA KEKURANGAN, semisal : RADIO ditiap daerah MASIH SEDIKIT & adanya IKLAN ROKOK, walaupun kalau berlangganan iklan TIDAK ADA. TERIMAKASIH, MUDAH MUDAHAN KEDEPANNYA BANYAK FITUR YG BERGUNA DI SEMATKAN & SEMAKIN KREATIF. THANX LARGE.",1,1,0,"ok punya, konten audio yg kreatif, & satu dalam semua, banyak fitur serta pada saat berpindah konten__pemutaran konten yg masih berjalan masih berlangsung dalam mode minimized.namun ,ada kekurangan, semisal : radio ditiap daerah masih sedikit & adanya iklan rokok, walaupun kalau berlangganan iklan tidak ada. terimakasih, mudah mudahan kedepannya banyak fitur yg berguna di sematkan & semakin kreatif. thanx large.",ok punya konten audio yg kreatif  satu dalam semua banyak fitur serta pada saat berpindah konten__pemutaran konten yg masih berjalan masih berlangsung dalam mode minimizednamun ada kekurangan semisal  radio ditiap daerah masih sedikit  adanya iklan rokok walaupun kalau berlangganan iklan tidak ada terimakasih mudah mudahan kedepannya banyak fitur yg berguna di sematkan  semakin kreatif thanx large,ok punya konten audio yg kreatif  satu dalam semua banyak fitur serta pada saat berpindah konten__pemutaran konten yg masih berjalan masih berlangsung dalam mode minimizednamun ada kekurangan semisal  radio ditiap daerah masih sedikit  adanya iklan rokok walaupun kalau berlangganan iklan tidak ada terimakasih mudah mudahan kedepannya banyak fitur yg berguna di sematkan  semakin kreatif thanx large,ok konten audio yg kreatif fitur berpindah konten__pemutaran konten yg berjalan mode minimizednamun kekurangan radio ditiap daerah iklan rokok berlangganan iklan tidak terimakasih mudah mudahan kedepannya fitur yg berguna sematkan kreatif thanx large,ok konten audio yang kreatif fitur berpindah konten__pemutaran konten yang berjalan mode minimizednamun kekurangan radio ditiap daerah iklan rokok berlangganan iklan tidak terimakasih mudah mudahan kedepannya fitur yang berguna sematkan kreatif thanx large,"['ok', 'konten', 'audio', 'yang', 'kreatif', 'fitur', 'berpindah', 'konten__pemutaran', 'konten', 'yang', 'berjalan', 'mode', 'minimizednamun', 'kekurangan', 'radio', 'ditiap', 'daerah', 'iklan', 'rokok', 'berlangganan', 'iklan', 'tidak', 'terimakasih', 'mudah', 'mudahan', 'kedepannya', 'fitur', 'yang', 'berguna', 'sematkan', 'kreatif', 'thanx', 'large']"
289,"aplikasi apaan sih, dah di download malah ga bisa di play, jelek apk nya",0,-1,0,"aplikasi apaan sih, dah di download malah ga bisa di play, jelek apk nya",aplikasi apaan sih dah di download malah ga bisa di play jelek apk nya,aplikasi apaan sih dah di download malah ga bisa di play jelek apk nya,aplikasi sih dah download ga play jelek apk nya,aplikasi sih deh download enggak play jelek aplikasi nya,"['aplikasi', 'sih', 'deh', 'download', 'enggak', 'play', 'jelek', 'aplikasi', 'nya']"
290,"Aplikasi ini sangat menyenangkan, banyak podcast yang seru dan edukatif disini",0,0,0,"aplikasi ini sangat menyenangkan, banyak podcast yang seru dan edukatif disini",aplikasi ini sangat menyenangkan banyak podcast yang seru dan edukatif disini,aplikasi ini sangat menyenangkan banyak podcast yang seru dan edukatif disini,aplikasi menyenangkan podcast seru edukatif,aplikasi menyenangkan podcast seru edukatif,"['aplikasi', 'menyenangkan', 'podcast', 'seru', 'edukatif']"
291,Sekarang kalo comment gak keliatan di aktifitas ya? Semenjak beli VIP,0,0,0,sekarang kalo comment gak keliatan di aktifitas ya? semenjak beli vip,sekarang kalo comment gak keliatan di aktifitas ya semenjak beli vip,sekarang kalo comment gak keliatan di aktifitas ya semenjak beli vip,kalo comment gak keliatan aktifitas ya semenjak beli vip,kalo comment enggak kelihatan aktifitas ya semenjak beli vip,"['kalo', 'comment', 'enggak', 'kelihatan', 'aktifitas', 'ya', 'semenjak', 'beli', 'vip']"
292,"bagus, cuman ya tetap sama aja, berbayar kalau ngga mau ada iklan wkwk. tapi saya puas kok. bisa dengar podcast kesukaan saya",0,1,0,"bagus, cuman ya tetap sama aja, berbayar kalau ngga mau ada iklan wkwk. tapi saya puas kok. bisa dengar podcast kesukaan saya",bagus cuman ya tetap sama aja berbayar kalau ngga mau ada iklan wkwk tapi saya puas kok bisa dengar podcast kesukaan saya,bagus cuman ya tetap sama aja berbayar kalau ngga mau ada iklan wkwk tapi saya puas kok bisa dengar podcast kesukaan saya,bagus cuman ya aja berbayar ngga iklan wkwk puas dengar podcast kesukaan,bagus cuman ya saja berbayar enggak iklan wkwk puas dengar podcast kesukaan,"['bagus', 'cuman', 'ya', 'saja', 'berbayar', 'enggak', 'iklan', 'wkwk', 'puas', 'dengar', 'podcast', 'kesukaan']"
293,Semenjak abis update klo ada yg tipe video suka keluar sndiri gk bisa fullscreen aneh! Bnerin lg lah tolong lah noice bete ni paranoice nnti,-1,0,-1,semenjak abis update klo ada yg tipe video suka keluar sndiri gk bisa fullscreen aneh! bnerin lg lah tolong lah noice bete ni paranoice nnti,semenjak abis update klo ada yg tipe video suka keluar sndiri gk bisa fullscreen aneh bnerin lg lah tolong lah noice bete ni paranoice nnti,semenjak abis update klo ada yg tipe video suka keluar sndiri gk bisa fullscreen aneh bnerin lg lah tolong lah noice bete ni paranoice nnti,semenjak abis update klo yg tipe video suka sndiri gk fullscreen aneh bnerin lg tolong noice bete ni paranoice nnti,semenjak habis update kalau yang tipe video suka sendiri enggak fullscreen aneh bnerin lagi tolong noice bete ini paranoice nanti,"['semenjak', 'habis', 'update', 'kalau', 'yang', 'tipe', 'video', 'suka', 'sendiri', 'enggak', 'fullscreen', 'aneh', 'bnerin', 'lagi', 'tolong', 'noice', 'bete', 'ini', 'paranoice', 'nanti']"
294,sangat baik untuk di dengar setiap hari,0,0,0,sangat baik untuk di dengar setiap hari,sangat baik untuk di dengar setiap hari,sangat baik untuk di dengar setiap hari,dengar,dengar,['dengar']
295,"aplikasinya bagus,,, bisa di cobaa",0,0,0,"aplikasinya bagus,,, bisa di cobaa",aplikasinya bagus bisa di cobaa,aplikasinya bagus bisa di cobaa,aplikasinya bagus cobaa,aplikasinya bagus coba,"['aplikasinya', 'bagus', 'coba']"
296,Kenapa harus premium sih kocak jadi males gw dengeri nya. Dah itu konten yang free jadi dikit lagi. Pendapatan dari iklan aja udah banyak ini di tambah lagi di suruh premium hedeh,0,0,0,kenapa harus premium sih kocak jadi males gw dengeri nya. dah itu konten yang free jadi dikit lagi. pendapatan dari iklan aja udah banyak ini di tambah lagi di suruh premium hedeh,kenapa harus premium sih kocak jadi males gw dengeri nya dah itu konten yang free jadi dikit lagi pendapatan dari iklan aja udah banyak ini di tambah lagi di suruh premium hedeh,kenapa harus premium sih kocak jadi males gw dengeri nya dah itu konten yang free jadi dikit lagi pendapatan dari iklan aja udah banyak ini di tambah lagi di suruh premium hedeh,premium sih kocak males gw dengeri nya dah konten free dikit pendapatan iklan aja udah suruh premium hedeh,premium sih kocak malas gue dengeri nya deh konten free dikit pendapatan iklan saja sudah suruh premium hedeh,"['premium', 'sih', 'kocak', 'malas', 'gue', 'dengeri', 'nya', 'deh', 'konten', 'free', 'dikit', 'pendapatan', 'iklan', 'saja', 'sudah', 'suruh', 'premium', 'hedeh']"
297,"Aplikasi paling favvvâ¤ï¸â¤ï¸ all podcast, cerita yg di apk ini baguss semuaaa",0,0,0,"aplikasi paling favvvâ¤ï¸â¤ï¸ all podcast, cerita yg di apk ini baguss semuaaa",aplikasi paling favvv all podcast cerita yg di apk ini baguss semuaaa,aplikasi paling favvv all podcast cerita yg di apk ini baguss semuaaa,aplikasi favvv all podcast cerita yg apk baguss semuaaa,aplikasi favvv all podcast cerita yang aplikasi bagus semua,"['aplikasi', 'favvv', 'all', 'podcast', 'cerita', 'yang', 'aplikasi', 'bagus', 'semua']"
298,Skrg noice malah harus bayar pake koin untuk beberapa konten. Mana ada iklan dimana-mana,0,0,0,skrg noice malah harus bayar pake koin untuk beberapa konten. mana ada iklan dimana-mana,skrg noice malah harus bayar pake koin untuk beberapa konten mana ada iklan dimanamana,skrg noice malah harus bayar pake koin untuk beberapa konten mana ada iklan dimanamana,skrg noice bayar pake koin konten iklan dimanamana,sekarang noice bayar pakai koin konten iklan dimanamana,"['sekarang', 'noice', 'bayar', 'pakai', 'koin', 'konten', 'iklan', 'dimanamana']"
299,Radio kesukaan saya dakta sudah bisa ğŸ˜,0,0,0,radio kesukaan saya dakta sudah bisa ğŸ˜,radio kesukaan saya dakta sudah bisa ,radio kesukaan saya dakta sudah bisa,radio kesukaan dakta,radio kesukaan dakta,"['radio', 'kesukaan', 'dakta']"
300,Kembalikan podcast sex and J-city,0,0,0,kembalikan podcast sex and j-city,kembalikan podcast sex and jcity,kembalikan podcast sex and jcity,kembalikan podcast sex and jcity,kembalikan podcast sex and jcity,"['kembalikan', 'podcast', 'sex', 'and', 'jcity']"
301,Podcast Hiburan & sumber informasi terbaik saat ini,0,0,0,podcast hiburan & sumber informasi terbaik saat ini,podcast hiburan  sumber informasi terbaik saat ini,podcast hiburan  sumber informasi terbaik saat ini,podcast hiburan sumber informasi terbaik,podcast hiburan sumber informasi terbaik,"['podcast', 'hiburan', 'sumber', 'informasi', 'terbaik']"
302,Seruuuu banget cerita podcastnya benerÂ² cocok untuk menemani waktu luang,0,0,0,seruuuu banget cerita podcastnya benerÂ² cocok untuk menemani waktu luang,seruuuu banget cerita podcastnya benerÂ² cocok untuk menemani waktu luang,seruuuu banget cerita podcastnya benerÂ² cocok untuk menemani waktu luang,seruuuu banget cerita podcastnya benerÂ² cocok menemani luang,seruuuu banget cerita podcastnya benerÂ² cocok menemani luang,"['seruuuu', 'banget', 'cerita', 'podcastnya', 'benerÂ²', 'cocok', 'menemani', 'luang']"
303,Bagus nih saya mudah dengar radio mantab,0,1,0,bagus nih saya mudah dengar radio mantab,bagus nih saya mudah dengar radio mantab,bagus nih saya mudah dengar radio mantab,bagus nih mudah dengar radio mantab,bagus nih mudah dengar radio mantab,"['bagus', 'nih', 'mudah', 'dengar', 'radio', 'mantab']"
