,clean_review,pengalaman visual,fungsi,performa dan stabilitas
520,unduh dengarkan podcastnya takut hal,netral,netral,netral
521,mati terus kalau ulang lagi dari kenapa ya pembaruan,netral,negatif,negatif
522,mantap suka aplikasi,netral,netral,netral
523,bag pemutaran berhenti loding terulang sinyal bagus,netral,netral,negatif
524,1 gamasalah iklannya 30dtk 1mnt tolong volumenya dikecilin 2 mengira aku saja tetapi banyak juga yang mersakan yang podcast tibaÂ² buffering tidak jelas tibaÂ² kepotong episode yang tidak bisa diplay koneksi amanÂ² saja tidak nyaman sekali dengerinya,netral,negatif,netral
525,unduh noice dengarkan podcast sus rini tertawa,netral,netral,netral
526,tidak kode otp nya,netral,netral,netral
527,begitu sudah beli vip masak terbatas dengarkan nya tidak perlu aneh aneh sat,netral,netral,netral
528,pembaruan berhrnti,netral,netral,negatif
529,ke sini aneh audio lag berhenti lewati konten konten habis pembaruan tidak bagus iklan saja aduh haduuuuh kocak,netral,negatif,negatif
530,fitur matikan push notifications tidak sudah pembaruan keversi yang berharap diperbaiki saja spam push notifikasi menggangu,negatif,netral,netral
531,saat youtube promosinya gembar gembor aplikasi minus suka berhenti saat dengarkan audio,netral,negatif,negatif
532,tidak tahu aplikasi suka mati ditengah jalan yang pengalaman yang,netral,netral,negatif
533,suara iklannya kecilin bangsaaaaat besar sekali suaranyaaa,netral,netral,netral
534,noice terbalikk aku suka tidak sekali keren aplikasi itunya,netral,netral,netral
535,eror memutar iklan,netral,netral,negatif
536,kurangi bintang memuat interfacenya,netral,netral,negatif
537,seru tolong iklannya suaranya dikecilkan fokus mendengarkan podcast suara yang tergolong muncul iklan suara,netral,netral,netral
538,tidak ini aplikasi,netral,netral,netral
539,bagus suka berhenti,netral,netral,negatif
540,sekarang dengar 1 vid bayar hadeh coba saja paket perbulan begitu supaya dengar yang,netral,netral,netral
541,ingin kasih bintang sepuluh suka podcast culik alam suka sekali menonton malam malam dengarkan podcast nya,netral,netral,netral
542,ke sini cari referensi podcast buset isi nya kebanyakan iklan lebih baik spotify tidak iklan nya,netral,netral,netral
543,jelek lag jaringan bagus,netral,netral,negatif
544,setiap hari pakai memutuskan uninstall saja kdg nge lag padahal jaringan bagus saja iklannya terus2an muncul,netral,netral,negatif
545,tolong volume iklannya kecilin kaget aku iklan lah satu2nyaaaa cempreeeeeengggg,netral,netral,netral
546,suara iklan telkomselnya kencang sekali,netral,netral,netral
547,juga sangat paywall contents sekarang a big disappointed sebagai an tua listener dari ini podcast,netral,netral,netral
548,mati berhenti dengarkan noice dibenerin appsnya,netral,netral,negatif
549,kasih fitur sort podcast yang sudah unduh plisss,netral,netral,netral
550,aplikasi ngebug dengarkan mati,netral,netral,negatif
551,sudah dengarkan noice versi web komputer laptop terima kasih kerja keras nya noice di dengarkan noice khawatir ponsel lowbat kerja _ semoga sistem log ini unduh versi web mudah ke depannya,netral,netral,netral
552,bagaimana ya sudah sebulan aplikasi tidak buka,netral,netral,negatif
553,admin pembaruan malah berhenti saat diplay mengulang tolong cepat diperbaiki ganggu sekali,netral,netral,negatif
554,suka mati ya lagi asyik dengar podcast mati sekali begitu,netral,netral,negatif
555,suara iklan tidak sinkron suara podcast nya suara iklan keras kaget repot turunin volume,netral,netral,netral
556,bagaimana sebenarnya kakak apdet kalau layar terkunci mati ya noice tidak seperti mohon diperbaiki,netral,negatif,netral
557,apalah aplikasi bikin keder habis unduh dihapus gegara buka channel yang tidak bisa2 mendingan lihat noice yutup saja daahh,netral,negatif,netral
558,mengira vidionya suara,netral,netral,netral
559,admin gwa tidak unduh pakai data,netral,negatif,netral
560,noice aplikasi podscast terbaik debat abdur mamat seru,netral,netral,netral
561,bagus unduh musuh masyarakat season 1 sampai,netral,netral,netral
562,sebenarnya aplikasi nya bagus saat asyik dengarkan berhenti gara gara jaringan lag aplikasi tidak ada lag tolong cek koneksi nya bikin jengkel saja,netral,netral,negatif
563,benar berbayar heeiii unduh noice karena musmas vip uninstall noice sedang di jalan reuploader yutup tidak peduli,netral,netral,netral
564,memaksa close saat dibuka pembaruan versi terbaru,netral,netral,negatif
565,beli konten vip kontennya dihapus lawak ini noice,netral,netral,netral
566,iseng unduh noice gara gara yout menjadi tidak relevan bunga konten noise onad hesti sayangnya sudah tidak perpanjang tolong reguler kalau supaya tidak bosan menunggu,netral,netral,netral
567,ya pulas tidurnya,netral,netral,netral
568,nge eror terus masuk memaksa close,netral,netral,negatif
569,setalah pembaruan andorid 13 sudah tidak maju mundurin notif,negatif,netral,netral
570,tolong kembalikan musuh masyarakat season 1 3 vip tidak,netral,netral,netral
571,iklan terus vip tertawa,netral,netral,netral
572,penarikan diamond tolong percepat 5 dana kunjung masuk rekening,netral,negatif,netral
573,instal noice hanya ingin dngerin musuh masyarakat sebenarnya ya sampai aku rekomendasi sama teman instal noice tetapi sekrg sudah pakai koin vip isi a seperti dngerin jokes bpak yang lagi ronda ciiaaaaaaaaa,netral,netral,netral
574,noice keren diisi media konten bagus pekerjaan noice,netral,netral,netral
575,dengarkan cerita hororr memang seru sekali cepat unduh mendukung noice,netral,netral,netral
576,yang berkata aplikasi berhenti ponsel kentang,netral,netral,positif
577,device samsung sekali crash appnya,netral,netral,negatif
578,5 bintang nya sekeren,netral,netral,netral
579,unduh menunggu terus admin,netral,netral,netral
580,juga sangat ada 30 sec unskipable ada everytime,netral,netral,netral
581,kadang putar dipause tidak menit,netral,negatif,netral
582,vip tidak ramah pecinta gratisan uninstall pindah spotify,netral,netral,netral
583,sebenarnya vip tidak seperti kebanyakan aplikasi pilihannya saja iklan premium sokÂ²an beda,netral,netral,netral
584,dengerkan trio kurnia tidak unduh noice terima kasih sudah hadirkan 3 pelawak terlucu dengerkan gratis noice keren trio kurnia kur kur kurrr,netral,netral,netral
585,sudah mata uang aplikasi sudah beli vip tetapi didengar episode berlaku 1bulan memang berlaku mendengarkan yang vip bagus pindah spo,netral,netral,netral
586,enak dengarkan eh mati sudah instal ulang tetapi tolong perbaiki ya aplikasinya menghibur,netral,negatif,negatif
587,musmas vip sebulan 2x lewati jokes bapak2 uninstal noice spotify lebih baik beli lucuflix supaya berbayar tetapi permanen satttttt,netral,netral,netral
588,bagus menambah ilmu,netral,netral,netral
589,aplikasi bagus didengar jalan-jalan pokoknya enak sekali dengar,netral,netral,netral
590,sumpah deh vipnya annoying sekali deh itu iklan molo buka episode,netral,netral,netral
591,tolong turunkan harga episode vip,netral,netral,netral
592,suka memuat terus 15 detik cerita eh memuat loadingnya tidak tahu,netral,netral,negatif
593,ya noice banet memuat lag jaringan bagus semoga cepat perbaiki eror nya,netral,netral,negatif
594,bagus mudah habis kuota saja kalau dengar,netral,negatif,netral
595,kasih bintang 2 saja deh unduh tidak pakai coin gratis kalau dengarkan pakai coin dengarkan nya uud ujungÂ² nya uang,netral,netral,netral
596,suka berhenti loncat menit episode kalau pause iklan terus sempat sinyal yang jelek kalau pakai aplikasi saja mengalami juga tolong perbaikiii,netral,negatif,negatif
597,tolong dengarkan podcast buka aplikasi dahulu mati,netral,negatif,netral
598,aplikasi nya habis pembaruan ke sini ke sana buka intro aplikasi nya butuh menit masuk hadeuuhhh,netral,netral,negatif
599,maaf kasih bintang 4 aneh jaringan lancar menonton reels instagram video tiktok lancar lancar saja lihat cerita wa lancar dengarkan noicenya ngelag jaringannya lancar,netral,negatif,negatif
600,bagus orang yang suka dengar podcast menarik,netral,netral,netral
601,saya kasih 4 bintang unduh ini,netral,netral,netral
602,sebenarnya kok sekali iklan dahulu tidak seperti ini deh saat sudah saja kebanyakan iklan tolong membanyaki iklan dengarkan podcast iklan,netral,netral,netral
603,maaf sekali iklannya kadang eror iklannya ngeganggu podcast saat didenger,netral,negatif,netral
604,suka aplikasi kerja dengarkan jalan dengarkan top naik ilklanya muncul terbaik saat promo saja seperti saat kampa e,netral,netral,netral
605,iklan muluu iklannya sekali tidak lewati saat sudah unduh data internet hidup masih saja iklan,netral,netral,netral
606,asli sebenarnya aku enjoy sekali dengernya postcast scarythings asli sebenarnya serunya malas dengar lagu,netral,netral,netral
607,radionya radio tidak radio moderen keren noice,netral,netral,netral
608,suka sekali aplikasinya seru malam dengarkan,netral,netral,netral
609,unduh ingin dengarkan cerita horor majelis ulama indonesia bi nad,netral,netral,netral
610,suka menghibur penuh informasi suaranya jernih enak telinga,netral,positif,netral
611,kalau fitur iklan dikembangkan sistemnya perbaiki jangan ingin enaknya saja,netral,negatif,negatif
612,lumayan bagus setia dengarkan radio daring hanya radio dikota tidak gabung disayangkan,netral,netral,netral
613,mencari uang jangan anggota sekelas youtube saja viewer gratis mencari uang nya adsense mencari uang anggota tidak ramai aplikasi ente,netral,netral,netral
614,kasih bintang 4 karena coba,netral,netral,netral
615,sekarang ngeclose ya jengkel,netral,netral,negatif
616,noice aplikasi bagus menemani,netral,netral,netral
617,hebat sebenarnya bagus,netral,netral,netral
618,cocok yang senang dengar visual,netral,netral,netral
619,bagus lumayan teman tidur,netral,netral,netral
620,pause saat diulang langsung iklan 30 detik sumpah kecewa noice saat unduh tidak seperti seperti ini,netral,netral,negatif
621,masukan noice tolong dong iklan mastering ulang dong audionya ngagetin saat pakai headhone headset standart mastering iklan standart rms audio noice supaya setara audionya aplikasi sebelah,netral,negatif,netral
622,cerita cerita nya bagus,netral,netral,netral
623,noice tolong diatur iklannya tidak memotong podcast tengah2 podcast saran saja ya terima kasih noice,netral,netral,netral
624,suka cerita takut thing,netral,netral,netral
625,berbayar tidak seru,netral,netral,netral
626,berat deh aplikasinya gambarnya jarang muncul tidak seperti ini deh buruk,negatif,netral,negatif
627,iklannya tidak beraturan ngeklik iklan memilih konten iklan saat putar iklan iklan kontennya tidak produktif tidak produktifitasnya,netral,netral,netral
628,podcast nya keren sekali ketagihan dengarkan,netral,netral,netral
629,bagus bagus sayang saja konten vip yang sudah membuka pakai koin tidak unduh dengarkan saat offline,netral,netral,netral
630,macet iklan tidak buka konten sampai berjam jam,netral,negatif,negatif
631,aplikasinya bagus suara ceritanya benar benar seru,netral,netral,netral
632,bikin versi android tv supaya dengarkan ngegame,netral,netral,netral
633,tidak iklan beli koin sudah aplikasi aplikasi,netral,netral,netral
634,kebanyakan iklan taiiiiiiiiiii aplikasi taikkkk iklan melulu,netral,netral,netral
635,sumpah kureng sekali suka lambat buffering mu sudah pakai wifi aplikasi lancar jaya noice saja,netral,netral,negatif
636,udahhh unduh tidak bisa putar payahhhhhh,netral,negatif,netral
637,bagus sekali tertawa suka majelis ulama indonesia bi,netral,netral,netral
638,dowload noice dengarkan podcast horor yang viral tt pass memakai memang bosan ya seru dengarkan belajar literaly ini aplikasi bagus sekali yang ingin dengarkan refrseshing lainya oh ya podcast lengkap horor sejarah komedi dan lain lain the terbaik lah pokok nya,netral,netral,netral
639,suka pocds geratis,netral,netral,netral
640,hapus audio sudah unduh bagaimana nya,netral,netral,netral
641,keren aplikasinya direkomendasikan malas membaca senang mendengarkan,netral,netral,netral
642,suka dengarkan radio daring noice pembaruan iklan putus bufering diulang disetiap ulang muncul iklan sambungan internet ku yang eror coba buka youtube lancar bufering disengaja dengar iklan bagaimana ya malas buka aplikasi,netral,negatif,negatif
643,bagus suka menonton horor cerita horor,netral,netral,netral
644,tampilannya bikin bingung aneh rumit,negatif,netral,netral
645,aplikasi nya enak aku dengar cerita horor olahraga wajib unduh,netral,netral,netral
646,sumpah keren seram sekali,netral,netral,netral
647,teman saat bosan pengantar tidur cocok sekali aplikasi tv,netral,netral,netral
648,burik sekali masuk saja susah suka sudah masuk kode otp tiba gbisa tidak mungkin sinyal sebenarnya,netral,netral,negatif
649,buntu diloading kadang2 muatan nya jaringan aman,netral,netral,negatif
650,noice podcast bagus dengarkan podcast,netral,netral,netral
651,tidak bosan dengarkan asyik seru terima kasih parah podcast suasana,netral,netral,netral
652,bagus sekali khusus pecinta horror wajib dengar terima kasih yang bikin nya seru sekali,netral,netral,netral
653,suka sekali taoi ke sini hadirnya coin konten premium nya lumayan mahal ya,netral,netral,netral
654,ingin mencoba ah tahu enak,netral,netral,netral
655,bagus sekali tidur dengarkan podcast seperti ceritain dongeng tidur tidak hihii,netral,netral,netral
656,suka aplikasi nya masuk nya kadang menunggu sekali sudah mengantuk ingin dengar podcast alhasil gajadi dengar,netral,netral,negatif
657,maaf kasih bintang 1 karena pembaruan dengarkan diluar aplikasi lancar2 saja pembaruan berenti saat dengar diluar aplikasi suka sekali aplikasi pembaruan,netral,negatif,netral
658,kadang noice berhenti kalau dengarkan poadcast tolong dibeneri ya,netral,negatif,negatif
659,aplikasinya bagus menghibur saran perbanyak podcast horor misteri didengarkan berlangganan premium,netral,netral,netral
660,semenjak musuh masyarakat tidak pembaruan aku hapus ini aplikasi,netral,netral,netral
661,konten audio saja suka buffering sebenarnya aku internet aku yang bermasalah terus coba youtube 1080p lancar jaya saja memang jelek aplikasi,netral,negatif,negatif
662,mantap aplikasi nya unduh deh tidak menyesal,netral,netral,netral
663,mati pause terus muatan aku aku seperti begitu ngalamin sudah reinstal saja tetap tolong diperbaiki ya admin terima kasih,netral,netral,negatif
664,tidak dibuka aplikasi nya,netral,netral,negatif
665,bolak bayar noice eror,netral,netral,negatif
666,suka sebenarnya desain interfacenya konten kontennya bagus bagus sekali podcast asyik tidak kehabisan bahan dengar enak saja begitu gabut gabut mengerjakan tugas dengarkan noice supaya tidak sepi cocok teman nyambi,positif,netral,netral
667,jujur suka parah aplikasi agak jengkel denngan dopup2 terbilang mahal banyaknya episode dengar tetap ikuti topup jengkel aplikasi freze iklan mengganggu ke sini ingin topup dengarkan podcast ingin uninstall aplikasi,netral,netral,negatif
668,trio kurnia kombek aku konbek tertawa,netral,netral,netral
669,suka dengarkan radio noice tidak pakai aplikasinya memori ponsel penuh suku bintang 5 websitenya yang pengguna friendly enak dipakai,positif,netral,netral
670,bagus sekali sayang buffering tidak buka yang lancar jaya,netral,netral,negatif
671,keunggulan noice itu pilih podcast saja episode saja baiknya kali ya kalau kelar episode set begitu kalau setel ulang tidak pindahnke episode,netral,positif,netral
672,aplikasi bermanfaat suka saja podcast seperti ini tidak ambil data,netral,netral,positif
673,mantap sebenarnya saran saja tmbhin sejarah nabi kerajaan dunia war dan lain lain,netral,netral,netral
674,tanya saja sebenarnya seperti spoon tidak yang seperti,netral,netral,netral
675,daftar terus kluar akun saat masuk laginya bagaimana masukkan nomor yang salah,netral,netral,netral
676,buka noice cerita horor misteri tertawa,netral,netral,netral
677,bagus sekali saya suka kalau dengar psang headsed terus seperti berasa dongengin begitu bagus,netral,netral,netral
678,enak sekali coook dengar skeri tings,netral,netral,netral
679,unduh giliran tidak unduh bufering semenjak vip bagus,netral,negatif,negatif
680,rekomendasi sekali aplikasi noice tidak debats,netral,netral,netral
681,bagus tidak apapun aplikasinya alhamdulillah podcast kisah inspiratif yang cocok sekali remaja usia 17 20 yang mencari jati luvv sekali pokonyaa,positif,positif,positif
682,bagus sekali cerita horror nya dengarkan sebenarnya,netral,netral,netral
683,membanyaki deh podcast cerita horornya,netral,netral,netral
684,aplikasi audio podcast yang suka karena didengarkan bagus ditambah audio book kembali cerita sejarah kerajaan datangnya belanda tertawa suka konten kreator podcast youtube hadir noice,netral,netral,netral
685,kurangi episod berbayar,netral,netral,netral
686,tidak otomatis daftar pakai akun google ponsel layar tombol selanjutnya nya kepotong tidak daftar deh uninstal deh,negatif,netral,netral
687,ya sekali ini kalau saat santai begitu tidak pekerjaan ngedengerin podcast suka lambemu kakak dono virza,netral,netral,netral
688,seru saja begitu cerita nya,netral,netral,netral
689,sudah pembaruan tetap saja saat klik sebenarnya lebih komentar appnya memaksa close crash hang perbaiki,netral,netral,negatif
690,ardan radio memuat saja perbaiki admin,netral,negatif,negatif
691,diperbaiki sistem fiture eror besar tidak jelas,netral,negatif,negatif
692,bagus sekali seru sekali tenang,netral,netral,netral
693,noicer membayar,netral,netral,netral
694,aplikasi nya bagus sekali wajib unduh sebenarnya dijamin tidak menyesal,netral,netral,positif
695,kekurangannya selanjutnya podcast tidak urut episode episode posisi selesai pencet atasnya tiru persis seperti spotify disana pilihan episode terbaru mudah jujur saja noice lengkap saja pelayanannya,netral,netral,netral
696,seru horor sekali,netral,netral,netral
697,iklanin supaya seperti spotify aplikasi belum terkenal aplikasi sebagus sayang sekali orang orang tidak mengenal benar-benar multi radio podcast audio dan lain lain yang tidak aplikasi2,netral,positif,positif
698,aplikasi bagus ku,netral,netral,positif
699,bagus sekali pop naik noice keren keren,netral,netral,positif
700,bagus dengar offline unduh ingin dengar nya ya podcast,netral,positif,netral
701,kok aku tidak masuk ya,netral,netral,netral
702,noice konten kreator bagus tidak unggah,netral,netral,netral
703,enak dengar seru merasakan horor nya,netral,positif,netral
704,terima kasih banyakk noice aplikasi mencermati isi podcasts aplikasi ini tertawa tertidur lelap dengar podcast nya hehhee,netral,netral,netral
705,kenapa pakai vpn tidak buka aplikasi nya tidak rumit pengaturan koneksi nya,netral,netral,netral
706,jaringan menonton radio ditambah admin,netral,netral,netral
707,bagus-bagus ceritanya pembawaan ceritanya agus sekali,netral,netral,netral
708,tidak tahu setelag pembaruan tidak buka noice suaranya seperti beda seperti seperti tidak jernih susah jelasinnya,netral,negatif,netral
709,pokoknya unduh aplikasi bahaya mangkaya kasih bintang berkata aplikasi berguna bermanfaat pelajar bohong orang gunakan aplikasi munafik,netral,netral,netral
710,bagus aplikasinya mendengar podcast horor,netral,netral,netral
711,bagaimana tidak bisa register tidak bisa masuk menu pilih rekomendasi tidak bisa,netral,negatif,netral
712,suka sekali dengar takut hal,netral,netral,netral
713,seru sekali menghibur galau,netral,netral,netral
714,suka dengarkan pengetahuan aplikasi keren,netral,netral,netral
715,aplikasi ini masuk tidak eror terus,netral,netral,negatif
716,aplikasinya bagus sekali cocok suka dengarkan podcast,netral,netral,netral
717,bagus bagus sekali sebenarnya ya,netral,netral,netral
718,isinya bagus kendala aplikasi,netral,netral,negatif
719,terima kasih tidak kesepian kerja dikebun,netral,netral,netral
720,podcastny suka tidak diplay sinyal bagus harus kelusr masuk aplikasi supaya menyebalkan admin,netral,negatif,negatif
721,bagus sekali aplikasinya didengerin tiduran dowload tinggal dowload saja ya dijamin tidak bikin kecewa,netral,netral,netral
722,aplikasi bagus yang cari cari,netral,netral,netral
723,tidak memutar video iklan bolak yang puter,netral,negatif,netral
724,aplikasi nya bagus sekali dengar cerita horor,netral,netral,netral
725,aplikasi bagus berguna yang suka dengar podcast horor,netral,netral,netral
726,noice the terbaik lah aku suka ini application,netral,netral,netral
727,ke sini noice podcastnya artis podcast2 seru sudah menghilang kembalikan opini malam interlude,netral,netral,netral
728,admin tolong invite sabrang mdp segment edukasi,netral,netral,netral
729,radionya tidak putar,netral,negatif,netral
730,nongkrong audio ter keren,netral,netral,netral
731,bagus sekali apknya dengarkan podcast nya suka,netral,netral,netral
732,sudah vip permanen sebulan,netral,netral,netral
733,aplikasi nya bagus sekali tetapi saat top naik banyak iklan tidak apa-apa sebenarnya perbaiki lagi,netral,netral,netral
734,gila rekomen sekali kamu internet bapuk teman,netral,netral,positif
735,terbaik mendengar podkes di saat gabut,netral,netral,netral
736,aku suka cerita2 podcast yang,netral,netral,netral
737,keren ih dengarkan podcast saja ini ya dengarkan yang horor begitu wussh mencekam sekali tidak sebenarnya terus ya tidak banyak yang suruh premium ya bouleh ya,netral,netral,netral
738,versi web tidak opsi pengecil audio nya ini web tidak niat orang yang ngelolanya ngantukan sudah pecatin saja karyawan tidak,netral,netral,netral
739,ganti perangkat ponsel saat unduh noice tidak masuk akun ya akun koinnya,netral,negatif,netral
740,noice berterima kasih habib saja jauh ini teman unduh beliau,netral,netral,netral
741,berkata apknya bagus eror pakai apknya bagus kok tidak kendala apapun noice ceritanya seru pokoknya bagus apknya,netral,netral,positif
742,noice aku nya iklan ngeklik eps 12 musmas iklan habis iklannya kelar putar eps 2 kocak iklannya 2x,netral,netral,netral
743,aplikasi bagus sekali dengarkan podcast seram lucu sedih,netral,netral,netral
744,enak sekali kalau tidur dengarkan kaum jomlo,netral,netral,netral
745,kontennya top sekali mantab aplikasi,netral,netral,netral
746,kebanyakan iklan woi dengarkan jadi tidak nyaman,netral,netral,netral
747,bagus sekali berimajinasi,netral,netral,netral
748,mantap kumpulan konten audio keren menemani perjalanan dan lain lain,netral,netral,netral
749,kalau buka appnya sudah pembaruan bugnya,netral,netral,negatif
750,unisntall berizik selesai noice,netral,netral,netral
751,pengalaman puas karena iklan tampilan nya jelek rumit tidak sederhana begitu sebenarnya yang tidak suka bagusnya isinya lumayan macemnya,negatif,netral,netral
752,iklannya tidak tanggung ramai tv langsung uninstall,netral,netral,netral
753,downgrade sekali pakai koin,netral,netral,netral
754,ritual tidur trio kurniaa kuurr kurrrr kurr kuurrrrr,netral,netral,netral
755,jernih tidak putis2 hiburan informasi nemenin macet mudik tidak putus tergantung providernya sebenarnya ya,netral,positif,positif
756,memaksa close konten yang unduh berputar tetap susah puter fungsinya unduh itu,netral,negatif,negatif
757,gila aplikasi isinya tracking tertawa,netral,netral,netral
758,unduh aplikasi karena takut hal tetapi entah noice lagi tidak buka padahal sudah pembaruan,netral,netral,netral
759,noicer pendengar musmas merajain top podcast 479jam mendengarkan lumayan beli konten vip tolonglah iklannya kebanyakan kalau dengar podcast monolog yang 2 3 admin terus iklan kesel tolong dikurangin iklannya satttt kakak satttt terima kasih,netral,netral,netral
760,suka parah tidak bosan dengarkan nya,netral,netral,netral
761,bagus sekali orang iklannya tidak lancar lancar saja dengernya betah bintang 1000 langsung kasih,netral,positif,netral
762,cerita menarik dengar,netral,netral,netral
763,kalau lihat komentar tidak penuh saat pencet lebih memaksa close appnya sudah pembaruan,negatif,netral,negatif
764,noice bagus tidak seperti the terbaik deh pokok nya,netral,netral,netral
765,kasih bintang saja deh nya aplikasi itu offline tidak pakai sinyal data supaya hemat saja begitu tolong ya jadikan offline ini aplikasi,netral,netral,netral
766,alternatif teman perjalanan didengerin kendaraan kendaraan pribadi tidur,netral,netral,netral
767,everyday dengarkan everyday pakai coin,netral,netral,netral
768,iklannyaaaaaaaa ya allah 4x dengarkan iklan 4x ganti topik iklan,netral,netral,netral
769,cocok dongeng saat tidur,netral,netral,netral
770,sudah top naik koinya tidak masuk,netral,negatif,netral
771,sinyal lancar gambar tidak lemod,netral,netral,negatif
772,suka cerita ceritanya teman tidur,netral,netral,netral
773,terima kasih sempat gratis vip sedang di jalan uninstall,netral,netral,netral
774,janjinya 100 koin buka membuka otomatis podcast takut thing nya saat episode barunya nongol tetap bayar 75 aplikasi penipu,netral,netral,netral
775,halo noice beli koin bri saldo terpotong koinya masuk,netral,negatif,netral
776,penempatan iklan mengganggu pilih ganti episode iklan penempatan iklan putar buka aplikasi iklan kali ganti episode,netral,netral,netral
777,aplikasinya keren podcast horor nya dapat sekali keren sekali sebenarnya,netral,netral,netral
778,tanx menemani luang kerja,netral,netral,netral
779,tiba-tiba lompat selanjutnya episode selesai kalau puter konten tidak tetapi mundur sekali kadang log out mohon perbaikannya,netral,negatif,negatif
780,suka sekali aplikasi nya senang dengarkan podcasts horor senang dengarkan audio series senang tahu aplikasi tertawa sukses,netral,netral,netral
781,top naik koin 100 koin 22 000rp tidak masuk masuk refresh berulang kali koinnya tidak masuk,netral,negatif,netral
782,aplikasinya memaksa close tiba-tiba ganti episode sekali iklannya kalau seperti ini lebih baik pindah lucuflix deh,netral,negatif,negatif
783,rocemendid instal,netral,netral,netral
784,keren hanya musik,netral,netral,netral
785,kebanyakan iklan 5 detik masih lebih baik iklan 20an ditambah teks asyik dengar baca,netral,netral,netral
786,iklanya menggangu sekali tolong ya dikurangin lagi aplikasinya bagus sekali,netral,netral,netral
787,terima kasih aplikasi thank kamu,netral,netral,netral
