,clean_review,pengalaman visual,fungsi,performa dan stabilitas
788,aplikasi bodoh username saja susah ampun,negatif,negatif,netral
789,unduh noice dengarkan takut hal,netral,netral,netral
790,setuju sekali ketuhan mendengar detektif astral keren,netral,netral,netral
791,aplikasi nya jelek aneh gakbisa dibuka terus tidak ada jaringan sudah dimasukin voucher mengira habis kuota saat dibuka masihttp susah masuk tidak ada jaringan tidak ada kuota tolong perbaikan,netral,netral,negatif
792,noice ponsel memaksa close ya dengarkan podcast terbaik alam semesta musuh masyarakat enak dengarkan memaksa close mengulang tolong solusinya paduka noice,netral,netral,negatif
793,unduh dengarkan podcast tretan muslim coki habib saja jauh,netral,netral,netral
794,heran pemikiran team team aplikasi tidak ngotak iklan putar nya episode nya vip koin terbilang mahal kecewa sekali yang pengguna friendly seperti ini ini aplikasi dengeri podcast spotify tidak bikin jengkel l dinoice,negatif,netral,netral
795,jadi jauh aku suka sama noice aku tidak tahu ya dengarkan podcast noice aku buka aplikasi itu tiba-tiba podcast yang aku dengarkan berhenti aku harus buka noice aku tidak tahu ponsel aku saja bagaimana padahal aplikasi nya sudah aku perbarui tetap saja,netral,negatif,netral
796,sekarang noice kebanyakan iklannya anjing tidak seperti noice yang dahulu,netral,netral,netral
797,benaran ya ya unduh aplikasi sumpah gila bagus sekali rasany ugh bagus deh wajib unduh wajib tidak unduh menyesal berhari 5,netral,netral,netral
798,donlod noice trio kurnia terima kasih,netral,netral,netral
799,aplikasi noice bikin kecewa masak ya sudah hps kali kebanykan loding padahal sudah unistal kali setlah donlowd nya terus beberpa jam buka harus loding sekali sialan jringan nya tajam sudah menunggu 15 mnit loding hadeh tolong pebarui kalau seperti ini mles masak ya unistal,netral,netral,negatif
800,kalau dengarkan podcasts top naik ya perasaan saat awal-awal booming tidak suruh top naik gratis sudah begitu iklan nya,netral,netral,netral
801,unduh ayo mudah tidur kalau dengarkan cerita horor nya aplikasi nya tidak mati ini kalau ponsel nya tidak buka posisi nyaman nya,netral,netral,netral
802,tolong noice aplikasi turunin keek apai begitu chromebook aku versi murah ya jadi saat tadi mengerjakan tugas kantor terus ingin dengarkan noice aku unduh device tidak mendukung mengsedihhhh,netral,netral,netral
803,noise terbaik pilihan lagu sekarang sound nya jernih tidak mengecewakan pelanggan,netral,positif,netral
804,fitur dengarkan menjengkelkan,netral,negatif,netral
805,kisah yang nemenin hari2,netral,netral,netral
806,sepertinya dahulu tidak ada deh iklan iklan seperti seperti ini ganggu sekali ingin dengarkan podcast terlanjur kedenger iklan jadi sudah malas saja buka lagi kalau iklannya sebentar tidak sekali,netral,netral,netral
807,asikk sekali dengarkan cerita nya,netral,netral,netral
808,aplikasinya bagus cerita seram indonesia,netral,netral,netral
809,ya kalau aplikasi saat seru-seru dengarkan podcastnya suka mati,netral,negatif,netral
810,aplikasinya bagus bermanfaat,netral,netral,netral
811,mengira kemarin gara pembaruan aplikasi nya tetap podcast sudah unduh saat dengar aplikasi berhenti saat putar mengulang tidak tahu podcast nya berhenti dimenit mlahan parah sudah unduh tidak putar kalau putar pakai data,netral,negatif,netral
812,cerita nya bagus dan seru sekali cerita horor nya bagus,netral,netral,netral
813,huh iklan konten yang berbayar,netral,netral,netral
814,bagus sekali dengar cerita hororr,netral,netral,netral
815,iklan mengganggu,netral,netral,netral
816,permisi tidak kalau iklannya dihilangkan ganggu sekali tahu tidak Ã² Ã³ å½¡,netral,netral,netral
817,coki tretan pecah,netral,netral,netral
818,sudah unisntall noice episode musuh masyarakat reuploder berkali kali,netral,netral,netral
819,deh bagus tetapi kok suka eror suka memuat sebenarnya padahal jaringan lancar saja buka yt tiktok aman saja kesalahan teknis,netral,netral,negatif
820,kalau terus bintang,netral,netral,netral
821,diinstall tidak dibuka,netral,netral,negatif
822,sepertinya sudah tidak relevan deh kaum mendang lebih baik aku konten aku suka berbayar terima kasih setahunnya ytb deh,netral,netral,netral
823,bagus suka dengarkan cerita cocok sekali sebenarnya rekomended tidak menyesal aku unduh,netral,netral,netral
824,the terbaik ini aplikasi gabut tinggal dengarkan noice serasa dongengin tertawa,netral,netral,netral
825,noice iklan ya ganti episode iklan tidak mendukung tidak dengarkan eps 7 iklan eh habis yang putar eps 10 pencet eps 7 iklan eps 10 tolong perbaiki eror bikin seperti tidak,netral,negatif,netral
826,cari cari channel radio cek dengarkan iklan 2x buset deh kacau,netral,netral,netral
827,deh malas kalau pakai bayar2an,netral,netral,netral
828,kasih 3 ya,netral,netral,netral
829,seru sekali terima kasih ya aplikasi karena peneman keren,netral,netral,netral
830,aplikasi bguss sieee terus layanan nya ramah setuju sekian pacar jaemin bayy,netral,netral,netral
831,iklannya 6 kali 1 episode,netral,netral,netral
832,ya bagus buet noicebook nya,netral,netral,netral
833,aku unduh karena dengar cokii ateis admin,netral,netral,netral
834,pembaruan iklan nya alih sekali parah,netral,netral,netral
835,bagus menyenangkan,netral,netral,netral
836,ngespam yt aku aplikasi kon memang,netral,netral,netral
837,noice cocok dengarkan cerita saja horor kehidupan dan lain lain saran vip tidak gratis bedanya sebenarnya vip tidak vip,netral,netral,netral
838,bagus saat top naik iklannya sekali tolong diperbaiki ya,netral,netral,netral
839,aplikasi nya sudah bagus tetapi ya dengarkan aplikasi nya itu suka berhenti ulang dari lagi tidak seperti ini tolong diperbaiki aplikasi nya,netral,negatif,netral
840,tolong perbaiki pembaruan aplikasinya kali dengarkan podcast tiba-tiba berhenti berhenti bugs yang,netral,negatif,negatif
841,kerren cu asyik ajak nongkrong,netral,netral,netral
842,iklan tidak fitur lewati iklan seperti youtube,netral,netral,netral
843,ke sini konten nya kebanyakan berbayar tidak manfaatkan fitur iklan sebenarnya cari duitnya seperti youtube sudah pakai paket data harus bayar konten,netral,netral,netral
844,ya saat dengarkan mati sleep kali nya mati,netral,negatif,negatif
845,luarbiasa bagus pengisi yang inspiratif pendengan deddyisuu,netral,netral,netral
846,aneh saja aplikasi anehnya sudah wakilkeun komentar,netral,netral,netral
847,suka sekali dengar radio surabaya jakarta makassar kabelÂ² semoga sukses dengar kisah horror penuh,netral,netral,netral
848,apknya setuju yang tidak asyik aplikasi deh ulas aplikasi nya 1 pengunggah cerita aplikasi kadang yang tidak setatus kelanjutan ceritanya deh kalau pitur yang pakai memperjelas kelanjutan ceritanya kalau tidak pengunggah cerita desak aplikasi nya perjelas kelanjutan ceritanya kalau begitu apapun yang nanggung aplikasi bikin dosa yang baca ingin toksik,netral,netral,netral
849,pembaruan daring demgerin radio suka mati nyala tidak,netral,negatif,negatif
850,gila sebenarnya seru abiesss,netral,netral,netral
851,tolong pembaruan saat masuk aplikasi nya logo noice nya sekali sampai kadang gajadi dengarkan koneksi stabil,netral,netral,negatif
852,aplikasinya bagus saat unduh podcastnya suka sekali aplikasinya tertutup saat buka unduh,netral,netral,negatif
853,komplit senang sekali gunakan aplikasi dengarkan cerita horor komedi banyak terima kasih developer sudah bikin aplikasi terima kasih,positif,netral,netral
854,bagus konten akses gratis tidak ada iklan kebanyakan konten vip iklan sekali kecewa sebenarnya noice,netral,netral,netral
855,bagus pakai aplikasi 2019 sekarang,netral,netral,netral
856,teman aku sudah dengarkan iklan itu tidak bisa lewati masak konten yang digembok sebenarnya seperti ini ini kalau sudah keisi artis tv kapitalis,netral,netral,netral
857,tidak masuk noicemaker studio buntu memuat screen,netral,netral,negatif
858,asyik dengarkan nya tahu,netral,netral,netral
859,aplikasi noice saat sekali nemenin santai aku kontennya asyik asyik mantap deh pokoknya,netral,netral,netral
860,aplikasi sekarang pindah podcast iklan terus 2 iklan lagi sekarang parah sekali seperti kamu iklan banyak-banyak,netral,netral,netral
861,sudah top naik tetapi coinnya masuk,netral,netral,netral
862,kalau mengasih iklan ya ganti episode 5 kali episode seperti ya ampun,netral,netral,netral
863,beli koin eror aplikasi sudah diupdate ini ya,netral,negatif,netral
864,coin nya tolong jangan mahal2,netral,netral,netral
865,tidak videonya woiii panteq,netral,negatif,netral
866,malas deskripsi kepanjangan ini aplikasi jelek,netral,netral,netral
867,terbaik aplikasi ini the dunia,netral,netral,netral
868,kadang memuat nya jaringan wifi bagus,netral,netral,negatif
869,disuruh dengar iklan saja ya iklan 17 detik lancar jaya giliran masuk podcast 2 detik langsung memuat sinyal kencang,netral,negatif,negatif
870,iklanya parah youtube,netral,netral,netral
871,tidak bagus nge eror aplikasi nya,netral,netral,negatif
872,episode unduh tidak bisa mainkan perlu iklan yang bikin tidak putar hasil unduh nya,netral,negatif,netral
873,iklannya tidak ngotak podcast 2 iklan diputar iklan menit menit dimasukkan podcast,netral,netral,netral
874,bagues sekali paling suka dengarkan cerita horor,netral,netral,netral
875,aplikasi yang bermanfaat bertambah ilmu,netral,netral,netral
876,aplikasinya keren sng sekali nongkrong saat jumattan terus dengarkan takut hal podcast tertawa pokoknya keren sekali deh,netral,netral,netral
877,bagus sekali ini aplikasi nyantai,netral,netral,netral
878,mengklik episode yang dengar iklan iklan diarahkan episode yang klik,netral,negatif,netral
879,noice sistemnya bagaimana ya aku ngeplay musmas episode 1 yang keplay episode salalu begitu diepisode manapun tolong ya sudah mengomongnya tolong diperbaiki ya,netral,negatif,netral
880,iklan 2x beruntun 34 detik total tidak sebegitunya,netral,netral,netral
881,top markotop serasa zaman mana ponsel radio,netral,netral,netral
882,konyol ini perbarui sruh masuk ulang sudah begitu putar daftar nya hilang,netral,netral,netral
883,mantap sebenarnya nemanin perjalanan tertawa seru saja begitu dengarkan cerita jalan jalan,netral,netral,netral
884,noice gudang ilmu yang pembaruan,netral,netral,netral
885,tolong iklan tengahÂ² durasi,netral,netral,netral
886,ntapp kali bahh dengar sembari tidur josss,netral,netral,netral
887,keseluruhan sudah bagus sekali sebenarnya hanya seperti dengarkan podcast berhenti lanjutin jarang sekali menit berhenti dengarkan mengulang begitu,netral,negatif,negatif
888,ini kalau bosan rekomen sekali pokoknya podcastnya beragam bagus-bagus,netral,netral,netral
889,eror nya ganggu sekali saat dengar iklan terus iklannya ulang2 asam,netral,netral,negatif
890,musuh masyarakat sungguh mengedukasiiii posternya flyermua keren2 ilustrasinya akui platform podcast nomor ya noice hanya segmentes orang indonesia ya sayang sekali bagus kalau exspansi pasar internasional podcaster,netral,netral,netral
891,aplikasinya jelek 1 10 masuk susah sekali,netral,netral,negatif
892,sumpah enak sekali dengar pagi minum kopi ngerokok,netral,netral,netral
893,tolong tambahkan shelter fm cirebon pilaradio cirebon kiss fm medan mfm malang mgt radio bandung hits unikom radio bandung,netral,netral,netral
894,lumayan terhibur aplikasi,netral,netral,netral
895,mantap saat sekali aku kerja lapangan supaya tidak bosan saat lagi dijalan,netral,netral,netral
896,aplikasi mantap nya lengkap,netral,netral,netral
897,uninstall aplikasi parah habis iklan putar jalan tidak suara kendala penggunan android smartcar,netral,negatif,netral
898,sampah iklan melebihi youtube,netral,netral,netral
899,bagus sekali tidak ada keluhan deh,netral,netral,netral
900,mengecewakan eror habis unduh ngebug gara gara iklan komtolll sudah dengarkan episode 6 unduh an episode 7 eh episode 6 seperti komtollll hapus data suruh unduh ulang eror episode 6 menunggu iklan tidak jalan-jalan iklannya kapitalis komtolll,netral,netral,negatif
901,gila sudah iklan kepanjangan unskipable pencet judul iklan 15 detik konten vip jadwal unggah tidak konsisten ubah sistem putar judul ads menit ads pilih judul saja tidak bisa tenang iklan terus,netral,netral,netral
902,suka dengarkan cerita horor unduh,netral,netral,netral
903,pembaruan ngebug komentar noice langsung tidak muncul,netral,netral,negatif
904,noice rusak ini masak aku buntu halaman masuk saja jangan masuk audio yang ingin aku dengar berandanya saja tidak,netral,netral,negatif
905,parah sebenarnya berhenti tengah2,netral,negatif,negatif
906,tidak baca taiping,netral,netral,netral
907,membantu sekali lagi sendiri seperti teman seruuu sekali keren,netral,netral,netral
908,mantap sekali tidak obat,netral,netral,netral
909,aku unduh noice dari ini aplikasi serba gratis sampai yang jumawa dikit2 uang dikit2 uang ya butuh cuan membagikan kreator memang top naik begitu pasang iklan dptin coin tidak pasti top uang yang top naik sebenarnya dibanding gratisan begitu saja tidak terpikirkan,netral,netral,netral
910,sebenarnya kasih iklan seperti ini putar menengok eps terbaru saja sudah iklanin tidak lewati,netral,netral,netral
911,sudah top naik koinnya tidak bertambah ya dengarkan episode terbarunya,netral,netral,netral
912,nyaman sesuai iklannya,negatif,netral,netral
913,sebenarnya vip nya tidak seperti puas dengernya tidak pakai vip kesel aku,netral,netral,netral
914,tampilan setelan radionya seperti kemarin nama radio judul lagu habis pembaruan judul lagunya tidak,negatif,netral,netral
915,suka sekali apalikasinya tidak rumit,positif,netral,netral
916,keren aplikasinya nemenin tidur,netral,netral,netral
917,iklan berhenti putar manual mulainya dari,netral,negatif,netral
918,instal noice dengar audio cast detektif astral semoga tidak eror,netral,netral,netral
919,aplikasi dengarkan podcast edukasi entertain rebahan,netral,netral,netral
920,bagusan yang versi nya setalah pembaruan iklan tidak lewati,netral,netral,netral
921,jelek sekali ganti podcast iklan,netral,netral,netral
922,iklan iklannya sudah habis tetap tidak diplay,netral,negatif,netral
923,fitur unduh ya deh didownload tetapi tidak diputar offline,netral,negatif,netral
924,sekali iklan nya,netral,netral,netral
925,uinya rumit kembali home page tolong fitur premium lelah lihat iklan muncul sampai 30 detik,negatif,netral,netral
926,noice iklan nya ganggu sekali,netral,netral,netral
927,iklannya tidak bisa lewati malas benar chuaks,netral,netral,netral
928,ngehibur sekali teman di saat nyetir yang asyik,netral,netral,netral
929,fitur unduh kalau tetap nyalain data seluler wi fi dengarkan hasil unduh lebih baik hilangkan fitur unduh tidak ketipu,netral,negatif,netral
930,bagus sekali aplikasi nya sekolah sediain dengar podcast noice,netral,netral,netral
931,tidak putar latar aplikasinya restart perangkat samsung tab a7,netral,negatif,negatif
932,ngebak mencari podcast menggangu mohon perbaikannya developer,netral,netral,negatif
933,membayar konten vip tidak dibuka,netral,negatif,netral
934,keren sekali noice kasih berputar musik noice,netral,netral,netral
935,iklan kebijakan pakai koin,netral,netral,netral
936,_bru unduh jadi di kasih 3 dahulu yah_,netral,netral,netral
937,ukuran unduh besar sekali kualitasnya sudah rendah podcastnya 15 sudah menyentuh 1 9gb,netral,netral,netral
938,direkomendasikan untuk podcast musik great terima kasih,netral,netral,netral
939,suka aplikasi cocok nemenin kerja nyantai dengarkan podcast,netral,netral,netral
940,atur di mana ya notif ganggu sekali,negatif,netral,netral
941,mantap teman tidur potkes a ini,netral,netral,netral
942,noice sudah tidak seru,netral,netral,netral
943,hanya mengalami versi mendengarkan ngebug diplay mohon noice sistemnya diperbaiki terima kasih,netral,negatif,negatif
944,eror nya parah tidak putar podcast apapun buntu iklan,netral,negatif,negatif
945,lumayan peganti radio kehidupan zaman sekarang,netral,netral,netral
946,asyik diperjalanan tidak bosan,netral,netral,netral
947,keren sekali hebat ini nemenin santai tidur,netral,netral,netral
948,saat buka audio series buka konten coin muncul warn data truncate,netral,netral,netral
949,bagaimana sebenarnya pembaruan tidak interfacenya bukanya mudahin maalah nyusahin konten terbaru halaman pindah ke mana,negatif,netral,netral
950,asli ini aplikasi keren sekali kalau sudah kluar branda saja dngrin,netral,positif,netral
951,seru sekali dengerinnya pecinta horor unduh ini konten horor seru,netral,netral,netral
952,perbarui tidak puter uninstall berkali2 saja,netral,negatif,netral
953,aplikasi nya suka mati menit,netral,netral,negatif
954,lebih baik bikin sistem premium koin,netral,netral,netral
955,unduh dengarkan detektif astral,netral,netral,netral
956,aku bintang 5 gara-gara menonton coki pardendeng,netral,netral,netral
957,aneh sekali ini noice last pembaruannya saat masuk room langsung mental mental aman aman saja loh,netral,netral,negatif
958,lumayan bancak ragam yang sukai,netral,netral,netral
959,upgrade tidak dengarkan siaran langsung sebenarnya mengecewakan mengecewakan,netral,negatif,netral
960,unduh aplikasi karena mantau cewek langsung disana senang yan andaaaaa main aplikasi chuaakssz,netral,netral,netral
961,pembaruan judul lagu yang putar radio hilangkan membantu sekali tahu penyanyi nya,negatif,netral,netral
962,eror nya ngelag putus putus dengarkan,netral,netral,negatif
963,membanyaki agamanya nya murotal ceramah,netral,netral,netral
964,podcaster komika yang berhenti sistem koin kapitalis tetap lebih baik dengarkan podcast spotify saja memang benar,netral,netral,netral
965,pokoknya aplikasinya mantaplah aku suka dengarkan cerita mistisnya aplikasinya mantap betull,netral,netral,netral
966,tidak dipakai sudah didownload tetapi masuk apknya tulisan tidak koneksi alien coba halusinasi sekali ayo memperbaiki dengarkan kasturi komeng adul ustad subki,netral,netral,negatif
967,suka ya aplikasinya keren tetapi minusnya ya begitu,netral,netral,negatif
968,siniar hiduplah indonesia maya,netral,netral,netral
969,aplikasi nya bagus sekali aplikasi pengantar dongeng tidur,netral,netral,netral
970,semoga ruang obrolan terbaik indonesia tidak kalah aplikasi penghasil uang nya,netral,netral,netral
971,admin angka komentar nya tidak ditengah dirapihin supaya enak dilihat,negatif,netral,netral
972,bisa unggah konten sendiri perbanyak podcastbuku,netral,netral,netral
973,hiburan favorit trio kurnia sari,netral,netral,netral
974,aplikasi yang bagus ceritanya seru seru cocok deh unduh,netral,netral,netral
975,bagus pilihan podcast nya,netral,netral,netral
976,dengarkan radio saja susupi iklan aduh parah uninstall,netral,netral,netral
977,nya siaran radio aplikasi terima kasih berharap membantu,netral,netral,netral
978,aplikasi yang bagus suka dengarkan podcast,netral,netral,netral
979,beli koin tidak masuk ya koinnya,netral,netral,netral
980,kasih bintang 4 iklannya banyak,netral,netral,netral
981,instal noice gara-gara ingin dengar konten musuh masyarakat saja,netral,netral,netral
982,sesungguhnya lakukan a bermanfaat diturunkan ketetapan allah diturunkan menolak merobah ketetapan taqdir kecuali lakukan a berdoalah menyantuni k2 ot mempererat silaturrahim menolong orang pemuda yang pedagang yang jujur menolong wanita jangan mengusir menghormat kepada yang tua kasih sayang kepada yang melapangkan duduk mencegah kemungkaran jangan membenci mendengki menunaikan amanat,netral,netral,netral
983,hoy noice tampilannya berubah lebih baik seperti tombol kali putar podcast tidak,negatif,netral,netral
984,noise ya tadi tidak bisa sebenarnya buka sa sekali buntu logo pembaruan tetap buntu logo,netral,netral,negatif
985,puas sistem koin,netral,netral,netral
986,beli koin buka konten endk diakses,netral,netral,netral
987,tidak tahu ya dengarkan podcast noice berasa lingkup diskusinya senang dengarkan ruang 28 suka opini podcast noice keren keren trio kurnia musuh masyarakat sumbu pendek noice aplikasi terbaik bagus pekerjaan sukses noice,netral,netral,netral
988,habis pembaruan ngebug berenti,netral,netral,negatif
989,aplikasi lambat mudah crah sebenarnya buka,netral,netral,negatif
990,terima kasih noice wadah podcast aktivis menyuarakan hati nurani rakyat bintang 5 noice karena podcast aktivis mendengar teriakan2 hati nurani rakyat yang gaungkan penguasa tidak mengkibuli masyarakat yang anggap bodoh,netral,netral,netral
991,trio kurnia the terbaik pokoknya,netral,netral,netral
992,memang eror bagaimana beli koin noice tidak nominal klik nominal keterangannya hitam dimiliki,netral,netral,netral
993,masak dengarkan saja bayar sebenarnya tidak asyik ini uninstal ya,netral,netral,netral
994,aplikasi noice saat buka buntu logo ya tidak terbuka uninstal,netral,netral,negatif
995,aplikasi suka tiktok saat coba bagus suka dengar cerita horor,netral,netral,netral
996,ntk pendengar yang unppler opinion bagus parah-parah pdcsternya undrdog semua tetapi kalau ntk kreator noice keribetan 64 aku pikir,netral,netral,netral
997,ya bayar,netral,netral,netral
998,noice nemenin aku kesepian,netral,netral,netral
999,bagus yang membacakan cerita juga enak dengar lagi kalau lagi drmh dengar noice jadi tidak berasa sepi lagi,netral,netral,netral
1000,pengalaman tidak asyik halo kakak eror aos 3 14 dicoba pembaruan aplikasi nya versi 3 15 ya kakak koin otomatis masuk senin refund otomatis 3 transaksi pembaruan versi 3 15,netral,netral,netral
1001,dengarkan noice fokus podcast hiduplah indonesia maya,netral,netral,netral
1002,bagus sekali sebenarnya nemenin,netral,netral,netral
1003,podcast terbaik hidup tertawa,netral,netral,netral
1004,membantu tidur nemenin lakukan aktifitas,netral,netral,netral
1005,tolong developer sedia ini kolom hapus konten menu unduh karena ditonton ingin dihapus tidak supaya tidak penuh kebanyakan,netral,netral,netral
1006,jadi jauh jadi bagus,netral,netral,netral
1007,sudah seru pakai aplikasi noice eh fitur vip senang badmood,netral,netral,netral
1008,iklan tidak mulaiÂ² dengarkan podcast tidak bisa menunggu iklan iklannya tidak playÂ² anjinglah ah,netral,negatif,netral
1009,musuh masyarakat adalah the bestt,netral,netral,netral
1010,keren berbayar diputar latar,netral,positif,netral
1011,tidak jelas vip kocak makan itu redup cepat,netral,netral,netral
1012,fitur tetapi tidak buruk,netral,netral,netral
1013,ada respons email,netral,netral,netral
1014,keren menghibur sekali cerita seru sebenarnya keren abiz,netral,netral,netral
1015,bagus sekali suara nya efek cerita tidak gambar suara,netral,positif,netral
1016,pembaruan top naik coin via gopay,netral,negatif,netral
1017,sudah beli koin buka konten tidak bisa didengerin kontennya,netral,negatif,netral
1018,aplikasi nya bagus saat main permainan pasti langsung geser nya tidak tolong di perbaiki,netral,negatif,netral
1019,komputer sudah belum ya kalau belum supaya ngedit,netral,netral,netral
1020,tolong sediakan yang versi web nya dengarkan sambil kerja dengarkan komputer kantor,netral,netral,netral
1021,audioseries audiobook berguna aktivitas,netral,netral,netral
1022,semesta merestui,netral,netral,netral
1023,kalau diminimize masuk aplikasi keulang podcast nya ganggu sekali,negatif,negatif,netral
1024,instal noice dengarkan trio kurnia kur kur kur,netral,netral,netral
1025,kapitalis apa-apa suruh bayar dengarkan,netral,netral,netral
1026,nutup otomatis saat menggulir komentar konten,netral,netral,negatif
1027,tolong bikin supaya muncul android auto yang dengarkan nyetir,netral,netral,netral
1028,eror ponsel huawei nova 5t lihat balasan komentar aplikasi langsung fc,netral,netral,netral
1029,kontennya bagus bagus dedy issue the terbaik konten,netral,netral,netral
1030,pembahasan asyik bermutu tema tongkrongan,netral,netral,netral
1031,teman bosan teman sepi menghibur tidak suka lihat visualnya ale kadang tidak fokus,netral,netral,netral
1032,suara pembawa acara ya suka sekali,netral,netral,netral
1033,vip,netral,netral,netral
1034,upgrade apa sek pancet saja tidak isok ngerungokno audio offline lek kuota internet e tidak nyala,netral,negatif,netral
1035,video koin sampai 200 v membanyaki sepi,netral,netral,netral
1036,trio kurnia kur kur kurrr,netral,netral,netral
1037,ah tidak serus tidak bagikan chromecast,netral,netral,netral
1038,imelda fm semarang kok tidak ya,netral,netral,netral
1039,tidak menonton video ya,netral,netral,netral
1040,aplikasi yang bikin hariÂ²ku berwarna tertawa cerita horornya seruÂ²,netral,netral,netral
1041,konten bagus ukurannya besar sekali kalau didownload tidak seperti spot ya beli ponsel,netral,netral,netral
1042,halo noice saya penikmat radio yang tinggal jakarta dari 1 jogja family radio tidak aktif alias tidak didengarkan salah punyaku favourite radio station tolong manajemen teknis noice diperbaiki menonton lagi terima kasih,netral,negatif,netral
1043,membantu mendengar podcastÂ² nya,netral,netral,netral
1044,apknya bagus kontennya menarik kalau bikin versi situs web dekstop nya supaya buka laptop,netral,netral,netral
1045,balikin lagi mumas dahulu tertawa,netral,netral,netral
1046,dengar podcast yang dipause kadang podcastnya tereset ditunggu perbaikan,netral,negatif,netral
1047,jelek eror truss,netral,netral,negatif
1048,aplikasi bugs kendala tidak muatan konten bugnya field pengisian username,netral,netral,negatif
1049,gunung dengarkan radio hmm,netral,netral,netral
1050,ku kasih 5 b awas tidak bagus ya,netral,netral,netral
1051,tidak putar sudah uninstal instal tidak putar,netral,negatif,netral
1052,noice teman kerja santai ping asyik,netral,netral,netral
1053,bagus sekali aplikasinya keren tingkatkan ya ditunggu,netral,netral,netral
1054,malas dengarkan noice sudah kapitalis dengarkan podcast favorit ku bayar lebih baik spotify gratis,netral,netral,netral
1055,ilmu humor,netral,netral,netral
1056,maaf uninstal dahulu ya noice merasa sudah besar kah sampai konten yang ramai harus berbayar semoga tidak aku yang tidak suka terima kasih,netral,netral,netral
1057,iklan tidak artis coki terus kesel sekali,netral,netral,netral
1058,teman galaw saat,netral,netral,netral
