,clean_review,pengalaman visual,fungsi,performa dan stabilitas
251,bagus wadah mendengar didengar pemikiran apapun menghujat apapun menghargai perbedaan,netral,netral,netral
252,fitur radio susah dimainkan,netral,negatif,netral
253,tidak masuk fb tidak metode masuk menu profile,netral,negatif,netral
254,tidak bisa suaranya,netral,negatif,netral
255,tingkatkan maju noice podcast sampai puncaknya ya zone,netral,netral,netral
256,tolong radionya diperbaiki sekali eror tidak bisa diputer,netral,negatif,netral
257,suka sekali sama ini aplikasi the besttt lahhhhh kalau podcastÂ² aku suka dengar podcast takut hal seru sekali jujurrr ini aplikasi worth itu sekali dengar offline cinta cinta deh kalau ada bintang 10 aku kasih rat 1000 10 sebenarnya,netral,positif,netral
258,suka aplikasi kerena suka dengar podcast,netral,netral,netral
259,bagus sekali agak kesel sekali premiumnya,netral,netral,netral
260,lagi asyik dngerin kali trkluar sendiri audio mati saat dngerin iklan sudah selesai iklan trkeluar begitu saja terus,netral,negatif,negatif
261,akun tidak langganan bulanan,netral,netral,netral
262,bintang dinaikin sudah dibaca keluhan terbesar eror tiba-tiba berhenti saat nyalain dibikin bosan menunggu iklan menit seperti seperti ini bikin bosan sekali,netral,netral,negatif
263,aplikasi nya bagus cerita horor film donwload tidak putar sialan tidak buang data memang akan ettdah negatif aku,netral,negatif,netral
264,kok tidak masuk ya gangguan tlng,netral,netral,negatif
265,bermanfaat menambah wawasan,netral,netral,netral
266,eror noice saat putar vidio podcast puter sendiri layarnya,negatif,netral,netral
267,lihat langganan nya tidak,netral,netral,negatif
268,menghilangkan overlay di bawah bagaimana ya ganti akun sebelah tidak bisa ganti akun,netral,netral,netral
269,asyik seru iklanya normal tidak mengganggu dengarkan podcast,netral,positif,netral
270,iklannya suka ngebug tolong ganggu sekali,netral,negatif,netral
271,5 menit mati menonton podcast jaringan lancar mohon perbaiki,netral,negatif,netral
272,aplikasi lumayan dengarkan radio daring,netral,netral,netral
273,enak tidak bosan dengar nya seru dengar,netral,netral,netral
274,pakai wifi tidak berputar,netral,negatif,netral
275,opini malam tidak,netral,netral,netral
276,tidak tahu sore dengarkan romance dawn dapat iseng lihat lalu lintas paket data 1 5gb hanya mode suara tidak pakai video,netral,negatif,netral
277,aplikasi tulil sinyal aku lancar saat nge putar macet macet tidak jelas memang benar dengar podcast ijo saja njinkkxxx,netral,negatif,netral
278,suka iklan nya noice tidak langsung atur otomatis mati saat iklan,netral,netral,netral
279,sedikit sedikit iklan ganggu benar asli,netral,netral,netral
280,halo mengembangkan noice kendala putar otomatis bagian audiobook judul buku audiobook mampun audiobook menu antrean berkas audio dengarkan langsung pada data internet coba semoga noice,netral,negatif,netral
281,kalau save data sekolah dasar setuju,netral,netral,netral
282,trio kurnia always ini punyaku heart,netral,netral,netral
283,kurangi durasi iklan iklan 30 detik muncul 2x,netral,netral,netral
284,bagus seru tidak gabut kalau tidak kuota,netral,positif,netral
285,iklan nya teman dengarkan cerita saat pergantian iklan bikin dengar cerita tidak tegang,netral,netral,netral
286,sudah unduh podcast tetapi saat didownload masih kosong,netral,negatif,netral
287,fitur widget,netral,netral,netral
288,setuju konten audio yang kreatif fitur berpindah konten__pemutaran konten yang berjalan mode minimized kekurangan radio ditiap daerah iklan rokok berlangganan iklan tidak terima kasih mudah mudahan ke depannya fitur yang berguna sematkan kreatif thanx besar,positif,positif,netral
289,aplikasi sebenarnya deh unduh tidak putar jelek aplikasi nya,netral,negatif,netral
290,aplikasi menyenangkan podcast seru edukatif,netral,netral,netral
291,kalau comment tidak kelihatan aktifitas ya semenjak beli vip,netral,netral,netral
292,bagus hanya ya saja berbayar tidak iklan tertawa puas dengar podcast kesukaan,netral,positif,netral
293,semenjak habis pembaruan kalau yang tipe video suka sendiri tidak fullscreen aneh bnerin lagi tolong noice bosan ini paranoice nanti,negatif,netral,negatif
294,dengar,netral,netral,netral
295,aplikasinya bagus coba,netral,netral,netral
296,premium sebenarnya kocak malas aku dengeri nya deh konten gratis sedikit pendapatan iklan saja sudah suruh premium hedeh,netral,netral,netral
297,aplikasi favvv semua podcast cerita yang aplikasi bagus semua,netral,netral,netral
298,sekarang noice bayar pakai koin konten iklan di mana,netral,netral,netral
299,radio kesukaan dakta,netral,netral,netral
300,kembalikan podcast seks dan saja city,netral,netral,netral
301,podcast hiburan sumber informasi terbaik,netral,netral,netral
302,seruuuu sekali cerita podcastnya benerÂ² cocok menemani luang,netral,netral,netral
303,bagus ini mudah dengar radio mantab,netral,positif,netral
304,membership supaya podcast murah,netral,netral,netral
305,unduh mudah mudahan bagus,netral,netral,netral
306,seperti ini moi bi nat,netral,netral,netral
307,memaksa close pemutarnya restart playing,netral,negatif,negatif
308,aman laah dengarkan radio kalau di bus dan lain lain podcastnya yang lucu-lucu,netral,netral,netral
309,aplikasi tidak jelas sudah beli konten premium iklannya,netral,negatif,netral
310,rumit tampilannya enak youtube simpel pamit,negatif,netral,netral
311,ğ˜£ğ˜¶ğ˜¨ fitur fitur ğ˜¥ğ˜°ğ˜¸ğ˜¯ğ˜­ğ˜°ğ˜¢ğ˜¥ konten konten yang diunduh seringkali tidak diputar mohon diperbaiki,netral,negatif,netral
312,teman iseng teman lagi buat,netral,netral,netral
313,video podcast tidak diplay,netral,negatif,netral
314,aplikasi the terbaik menyediakan konten konten keren,netral,netral,netral
315,terima kasih aplikasi noice,netral,netral,netral
316,bagaimana langganan noice premium tidak klik,netral,negatif,netral
317,mahal iklannya lagi sekarang,netral,netral,netral
318,kontenya saja keren apa lagi ada fitur video sekarang,positif,positif,netral
319,bagus sekali aplikasi nya takut hal favorit,netral,netral,netral
320,eror aplikasi lancar,netral,netral,negatif
321,dengarkan podcast 5 detik langsung auto eps iklan tidak diskip lazada bahagia lazada bahagia kirim cepat gratis ongkos kirim uangmu lazada bikin bahagia bahagia b ngs t,netral,netral,netral
322,sudah langganan premium saat perpanjang langganan bingung seperti ini ya bagaimana,netral,netral,netral
323,kapitalis bayar yang tidak worth itu lebih baik langganan vidio menonton liga inggris,netral,netral,netral
324,pokoknya bintang malas menulis tahu bintang,netral,netral,netral
325,bngst kontrak lambemu tidak diperpanjang ingat bikin kamu besar bngst,netral,netral,netral
326,halo noice beli coin masuk masuk akun kendala di mana ya,netral,netral,netral
327,mantap fiturnya pilihan informatif,netral,positif,netral
328,sistemnya tidak dibikin berlangganan saja mahal kalau pakai koin,netral,netral,netral
329,platform sepi kebanyaan iklan kntl,netral,netral,netral
330,suka sekali aplikasi tolonglah dengarkan episode bayar pakai coin sudah begitu harga koin mahal sekali,netral,netral,netral
331,gila itu keren sekali asyik cinta kamu penuh noice,netral,netral,netral
332,seru sebenarnya,netral,netral,netral
333,setuju sekali nemenin hari2 stay pada noice,netral,netral,netral
334,tidak unduh lancar saja tidak menunggu tidak jalan sudah dm respons,netral,negatif,netral
335,aplikasi pengantar tidur bagus sekali,netral,netral,netral
336,konten vip ke depannya pakai koin langsung biaya bulanan kalau,netral,netral,netral
337,benar-benar kebanyakan iklan ingin mencari salah eps trio kurnia saja dengar iklan banyak perlu,netral,netral,netral
338,seruuu rebahan dengarkan cerita horor,netral,netral,netral
339,suka mendengarkan aplikasi bagus sekali tidak tahu susah sekali bikin audiogram nya ya,netral,netral,netral
340,iklan ganggu tidak seperti,netral,netral,netral
341,unduh gara gara lihat syifa angga,netral,netral,netral
342,keeren sekali ini dengarkan di mana saja terus juga lucu-lucu,netral,netral,netral
343,awal-awal enak saja ya dengarkan sambil buka aplikasi kayk daring shop begitu ke sini mati kalau dibuat buka aplikasi kan kesel ya hemmmm,netral,negatif,netral
344,platform mendengarkan podcast pure podcast kualitas suara bagus jenis podcast,netral,positif,netral
345,iklan nya sebenarnya,netral,netral,netral
346,peredaran puncaknya menyelera berpendapat,netral,netral,netral
347,asyik dengarkan cerita podcast menyenangkan kualitas audio,netral,positif,netral
348,perpaduan hiburan teknologi mutakhir,netral,netral,netral
349,senang bertambah ilmu tahu,netral,netral,netral
350,aplikasi nya sekali buntu logo noice tidak masuk,netral,netral,negatif
351,dengarkan podcast bagus sedikit bayar,netral,netral,netral
352,tingkat fitur video nya tampilan landscape konfirmasi,netral,netral,netral
353,durasi iklannya konten dipaksa menonton iklan total durasinya semenit ini okay kalau iklan salah sumber pendapatan sarannya iklan diselipin konten kalau berpengaruh kenyamanan pendengar tidak noice ditinggalkan kalah kualitas spotify,netral,netral,netral
354,nutup pemutaran tidak berputar konten putar konten aneeehhhhhh,netral,negatif,netral
355,respons admin cpet ada kluhan aplikasi saat nmenin krja nyantai,netral,netral,netral
356,mantap kontenÂ²nya puas vip nya seru didengar saran podcast musuh masyarakat diperbanyak versi videonya admin tertawa,netral,netral,netral
357,aplikasi versi webnya jelek susah sekali tidak dibenerin versi webnya tidak orang mendengarkan gawai orang kantoran seharian komputer kalau akun tinggal masuk tidak lancar versi webnya harap cepat perbaiki versi webnya mudah,netral,netral,netral
358,noice dengarkan trio kurnia,netral,netral,netral
359,cinta sekali aplikasi ini,netral,netral,netral
360,konten vip yang beli pakai koin tolong menghilangkan teman,netral,netral,netral
361,rumit seperti ini perasaan tidak seperti ini,negatif,netral,netral
362,saja ini jadikan aplikasi berbayar apa-apa bayar jelek-jelek gratisin dasar kapitalis,netral,netral,netral
363,seru sebenarnya sumpah masukkan namanya susah sekali kasih 5 bintang deh,negatif,netral,netral
364,unduh instal noice dengar trio kurnia,netral,netral,netral
365,akhir2 dengarkan podcast audio mati putar putar manual lelah sekali,netral,negatif,netral
366,parah noice pembaruan maksa tidak tunda aplikasi berat,netral,netral,negatif
367,memaksa close terus ya buka aplikasi berat tidak seperti ini selanjutnya pembaruan tolong diperbaiki,netral,netral,negatif
368,berbayar mahal sekali deh terharu,netral,netral,netral
369,unduh audio dengarkan malam tetapi tidak tahu lihat downloadnya sederhana terus kasih tema aplikasi nya fitur downloadnya kasih profil namanya msukin folder unduh an dengan nma unduh an beda begitu unduh an nya,negatif,netral,netral
370,room langsung tidak ya tidak muncul tombolnya,negatif,netral,netral
371,log ini akun podcast2 yang didownload hilang,netral,netral,netral
372,1 tampilan nya tidak familiar rumit 2 kalau sebenarnya kontennya vip dibikin eksklusif saja konten gratisannya kasih sample 2 menit penuh 3 dibikin seperti ott berlangganan 4 kasih batas pemutaran tidak bayar 1 jam 5 putar log ini scan wajah supaya dengarkan komentar tidak,negatif,netral,netral
373,keseluruhan podcaster bagus saat ke sini podcast podcast asyik bungkus sudah tidak mengerti noice dibawa ke mana dahlah spotify memang benar oh ya terima kasih 4 hiburan nya,netral,netral,netral
374,bagaimana masuk akun noice ya tidak sengaja klik akun,netral,netral,netral
375,ğ›ğšğ ğ®ğ¬ğ¬ ğ¬ğ¢ğœğ¡ ğœğ®ğ¤ğ®ğ© ğ¥ğ®ğ¦ğšğ²ğšğ§ ğ¨ğ¤,netral,netral,netral
376,rip noice podcast favorit aku bungkus terima kasih hiburan 4 terakhirnya spotify terbaik,netral,netral,netral
377,aplikasi keren benaran kumpul konten audio podcast musik radio sampai buku audio,netral,netral,netral
378,konten nya seru pokoknya aplikasi terbaik semoga aplikasi berkembang sukses,netral,netral,netral
379,aplikasi nya pakai sudah notip maaf eror aplikasi apa cuk,netral,netral,negatif
380,bintang 1 entar ckh sudah rilis kasih bintang5,netral,netral,netral
381,ingin menonton mamat melawan abdur kalau programnya bagus bagus bintangnya deh,netral,netral,netral
382,bagus tetapi saat degar tidur iklan langsung kaget saat pakai henset bikin jantugan,netral,netral,netral
383,buka aplikasi noice berat sekali lambat hasil unduh tidak putar kasih bintang 5 turun deh 4 mohon perbaiki supaya pembaruan terima kasih,netral,netral,negatif
384,iklan nya kurangi terima kasih,netral,netral,netral
385,top naik coin gagal,netral,netral,netral
386,pacdcast kalau dengerkan pakai koin kalau biaya top naik koin nya murahin kalau cek ini harian yang hadiah koin juga,netral,netral,netral
387,suka,netral,netral,negatif
388,cerita audio series nya bagus hidup tidak monoton saran dubbing tidak berlebihan olah karena terkadang apa sebenarnya seperti ini begitu disesuaikan saja skrip karena fokusnya didengar ditonton,netral,netral,netral
389,serunya podcast noice muantap rek,netral,netral,netral
390,salah podcast terbaik indonesia,netral,netral,netral
391,suka keren habis pokao nya,netral,netral,netral
392,pokoknya cocok sekali orang yang suka ngedengerin podcas2 berbentuk audio seru sekali konten2nya,netral,netral,netral
393,tidak sebagus,netral,netral,netral
394,mantap jiwa indonesia merdeka merdeka merdeka,netral,netral,netral
395,video terbaru vip,netral,netral,netral
396,pembaruan eror mendengarkan audiobook,netral,negatif,negatif
397,bagus buatan lagu nya suaranya bagus sekali,netral,netral,netral
398,dengarkan tiba-tiba tidak sinyal bagus tidak putar saat coba ee tidak putar podcast yang sayang langganan tolong ya maaf bintang 2 ya,netral,negatif,netral
399,membutuhkan sponsor mengembangkan usaha tidak podcast,netral,netral,netral
400,the terbaik pandeka dan trio kurnia kurrr kurrrr kurrrr,netral,netral,netral
401,senang sekali sama crita horor nya,netral,netral,netral
402,mantap mengisi hariku konten yang didengar banyak konten hiburannya,netral,netral,netral
403,noice mengadakan fitur unduh podcast kartu sekolah dasar dong penyimpanan internal penuh ini oh ya fitur noice premiumnya keren,netral,netral,netral
404,kapan-kapan kasih bonus koin,netral,netral,netral
405,jadi tidak bisa dibuka padahal deh instal ulang berkali2,netral,netral,negatif
406,terima kasih sudah tidur dengarkan cerita semuga sehat amin,netral,netral,netral
407,podcast konten berbayar,netral,netral,netral
408,bagaimana sebenarnya bikin premium entar kalau deh bintangnya dinaikin,netral,netral,netral
409,bagus sekali ini aplikasi mati dari aplikasi disuruh bayar ikut bayar volume kencang iklan tetap didengerin kuping sakit jadi mati dari aplikasi hebat hebat kalau ke depannya tidak dibuka begitu aplikasinya supaya seru,netral,negatif,negatif
410,podcast seru menyenangkan,netral,netral,netral
411,aplikasi nyaman,netral,netral,netral
412,dengarkan musik radio tidak nyalain tolong baikin,netral,negatif,netral
413,kontennya menarik recomended bugs nya ganggu lag kadang eror sampai tidak diapa apai mohon diperbaiki,netral,netral,negatif
414,sudah tidak semenarik konten vip tidak berbobot beli koin,netral,netral,netral
415,konten yang beli kenapa banyak yang kevtutup,netral,netral,netral
416,pakai uang sekarang tertawa,netral,netral,netral
417,eror autoplay audiobook loncat episode setel ep 1 langsung autoplay episode 3 aneh sekali,netral,negatif,netral
418,tidak fitur video,netral,netral,netral
419,mati suara iklan keras dengarkan podcast isi top naik coin tidak sebagus,netral,negatif,negatif
420,aku beli noice premium paket bulanan 150 koin tetapi membuka 3 podcast sudah tidak beli paket noice premium 4 harian sudah tidak,netral,netral,netral
421,masuk tidak kunjung kode otp ya,netral,negatif,netral
422,tidak sudah beli premium konten vip tidak diakses,netral,negatif,netral
423,pembaruan iklannya sekali tolong kembalikan noice yang,netral,netral,netral
424,seperti ini sekali kalau sudah laku semenjak fitur vip ya kali sudah dengar pakai kuota bayar pakai uang sumpah kecewa sekali sebenarnya noice maaf cari uang terima kasih covid sudah nemenin ingin langganan noice sudah tidak asyik,netral,netral,netral
425,bagus sudah saja bingung mengomong intinya ya bagus ya,netral,netral,netral
426,iklan tidak bisa lewati tekan apaapa iklan,netral,netral,netral
427,sudah pembaruan versi terbaru tidak bergabung premium kalau buka gembok opsi tidak sudah refresh berulang ulang tetap saja muncul opsi bergabung premiumnya,netral,netral,negatif
428,ke sini ke sana arah tujuan noice hiburan gratis mengisi kekosongan hiburan berbayar tujuan menghibur masyarakat menguras kantong masyarakat noice memang fokus sekali cari cuan sampai sampai melupakan tujuan kasih contoh konten musuh masyarakat s1 sampai s4 tidak pakai koin s5 pakai koin noice perlahan lahan musuh masyarakat benaran bagaimana sebegitunya cari cuan,netral,netral,netral
429,talentnya sudah tidak seseru ditambah konten diduitin kalah spotify,netral,netral,netral
430,ke sini iklan,netral,netral,netral
431,enak sekali didenger saat perjalanan supaya tidak gabut,netral,netral,netral
432,servernya perbaiki fakk macet macet terus dengerinnya,netral,negatif,negatif
433,keren menghibur tolong khusus komputer,netral,netral,netral
434,pensiun noice 350 jam mendengarkan alesan parah benar iklan fitur vip bayar puluhan ribu buka 1 episode lebih baik kalau vip bayar buka episode kalau ya rungkad lebih baik kabur spotipi yeey,netral,netral,netral
435,garaÂ² sebenarnya trio kurnia paman vincent paman desta komandan andre aku unduh ini aplikasi,netral,netral,netral
436,enak sekali dengarkan di home store peneman sepi ya peneman tidur ya sukses ya,netral,netral,netral
437,heran wifi lancar tetap saja lag,netral,netral,negatif
438,habis pembaruan malah buffering unduh padahal aku buka yutub dan lain2 lncar2 saja,netral,netral,negatif
439,mantap noice,netral,netral,netral
440,tambahkan stasiun radio makassar ya admin,netral,netral,netral
441,konten berbayar episode terlambat,netral,netral,netral
442,bintang abdur melawan mamat,netral,netral,netral
443,alhamdulillah fitur berlangganan,netral,netral,netral
444,ah noice keren selalu suka dnger trio kurnia,netral,netral,netral
445,bayar kalau dengarkan yang terbaru suck,netral,netral,netral
446,beli paket musmas besoknya tidak,netral,netral,netral
447,noice sebenarnya sudah didownload tidak puter,netral,negatif,netral
448,aplikasi bagus cocok kalangan,netral,netral,netral
449,mahal koin nya susah dijangkau podcast artist yang tidak menarik podcast daerah yang bagus sudah bungkus tersisa berizik yang tidak banyak vip nya berizik bungkus vip tidak mengerti mengapai instal noice,netral,netral,netral
450,siaran nya tidak macet aplikasi yang bersih mudah untuk menjelajahi walaupon pengguna dari indonesia bagus pekerjaan dan itu sebenarnya fantastic,netral,positif,positif
451,rumit pakai koin sekarang,netral,netral,netral
452,akhirÂ² eror bertahan garaÂ² trio kurnia,netral,netral,negatif
453,pengguna aplikasi menghibur kualitas konten suaranya bagus,netral,positif,netral
454,aplikasi podcast terbaik direkomendasikan,netral,netral,netral
455,aplikasi menemani perjalanan depok jakarta,netral,netral,netral
456,cocok sekali aktivitas setiap hari fitur nya ya pokoknya aplikasi memang khusus entertain masyarakat iklan nya bersahabat semoga ke depannya aplikasi ke depannya berkualitas,positif,positif,netral
457,saat unduh dengarkan noice radio ragu takutnya sinyalnya putus2 saat dengarkan puas diperjalanan menghibur thank kamu ya noice,netral,positif,netral
458,aplikasi audio konten bermutu tampilan aplikasi perbaiki pengguna friendly,positif,netral,netral
459,ayolahhh notifikasi nya nyepam sekali sudah disable loh pengaturan aplikasi nya,negatif,netral,netral
460,isinya kebanyakan artis mengobrol tidak ketawa ketiwi saja tidak pelajaran yang ambil,netral,netral,netral
461,tidak masuk karena daftar saja deh akun yang gagap teknologi,netral,netral,netral
462,keren aplikasi nya semangat kakak,netral,netral,netral
463,top naik berhasil coin tidak bertambah,netral,negatif,netral
464,bagus tidur tolong iklannya kasih tidak dongk,netral,netral,netral
465,eps audioseries gratis dengarkan pakai koin kadang memutar podcast buffering tidak,netral,negatif,netral
466,aku suka aplikasinya tidak masuk ya tertawa habis pembaruan tidak masuk via facebook,netral,negatif,netral
467,gara gara menonton musuh masyarakat youtube lucu unduh noice menonton penuh nya bayar weelehhh,netral,netral,netral
468,sudah pembaruan nge eror tidak kebuka giliran hapus data eh log ini file2 hasil unduh hilang awal-awal itu eror seperti ini tidak berpengaruh hasil unduh hapus data,netral,netral,negatif
469,kurangi bintang podcast favorit sudah bungkus,netral,netral,netral
470,bayar atau tidak sebenarnya sudah bagus,netral,netral,netral
471,aplikasi sejuta eror bentar_bentar ngebug servernya perlu bagusan server zeus hadeuhh,netral,netral,negatif
472,4 star dahulu ya belum di unduh google tv,netral,netral,netral
473,bagus aplikasi tidak terbuka mohon bugnya pasti admin,netral,netral,negatif
474,kualitas audionya sudah bagus buffering saat cek koneksi lancar lancar saja mohon almaighty noice pasti secepatnya,netral,netral,negatif
475,sayang sekali tidak bisa putar prfm bandung,netral,netral,netral
476,dengarkan tidur,netral,netral,netral
477,suka sekali aplikasi risih saat enak enaknya dengar eh berhenti ponsel ku lambat kawan begitu,netral,negatif,negatif
478,ku kasih bintang 4 saja deh karena masih yang sedikit menurutku,netral,netral,netral
479,bagus sekali konten audionya berharap diperbanyak kontenÂ² pengembangan kesehatan fisik dan mental konten spritual membantu memperbaiki kondisi penyakit kronis generasi milenia,netral,positif,netral
480,kalau langganan saja episode kamu bayar bintang 1 dahulu,netral,netral,netral
481,bosan buka aplikasi berbayar mendengarkan podcast lamaa,netral,netral,netral
482,memuat terus saat dengarkan podcast yang eps jaringan aman,netral,negatif,negatif
483,noice aplikasi musik spotify aku tidak aku aplikasi menonton musik seperti spotify noice mendekati podcast tolonglah dukung musik aplikasi,netral,netral,netral
484,bagus sekali ini ya tolong sekali swlesai iklan pindah episod tolong sekali ya,netral,negatif,netral
485,noicer kapitalis,netral,netral,netral
486,ponsel suka memaksa close tolong betulin ya,netral,netral,negatif
487,volume iklan sponsor bikin telinga sakit niatnya dengarkan podcast menenangkan dibikin kaget maaf2 ini tidak tuli volume tidak perlu sekencang,netral,netral,netral
488,berat mengetik langsung room saja berat sekali sampai ponsel panas upgrade itu jelek maaf ya malas pakai noice,netral,netral,negatif
489,sudah tidak seru kebanyakan vip tidak seperti dahulu,netral,netral,netral
490,bermasalah tau2 podkesnya berenti tidak dilanjutin aplikasiharus ditutup dibuka supaya ngelanjutin pagi itupun kadang mengulang,netral,negatif,negatif
491,server tolong dibenerin sinyal penuh menonton ytb ya dengarkan noice macet macet,netral,negatif,negatif
492,konten nya bagus bagus pause kalau main permainan,netral,negatif,netral
493,aplikasi bagus menyenangkan,netral,netral,netral
494,banyak iklan beli vip,netral,netral,netral
495,unduh hanya dengar cerita horor moybinad hahahahah seru habis,netral,netral,netral
496,podcasternya tidak jelas tidak jelas terdengar asyik berisik tetap spotify terbaik,netral,netral,netral
497,bagus sekali eror terhenti mendengarkan offline ter unduh terkadang mendengarkan out aplikasi buka ulang aplikasi,netral,negatif,netral
498,iklan nya mengganggu ini tolong fitur premium bulanan,netral,netral,netral
499,crash ditengah-tengah putar podcast,netral,negatif,negatif
500,bagus kecuali sistem beli beli episode saran sistem langganan saja,netral,netral,netral
501,kalau dari aplikasi terus buka aplikasi podcastnya berhenti masuk mengulang masa ya harus dipantengin tolong perbaiki bugnya,netral,negatif,netral
502,aneh tulisan ya fitur video penuh versi tidak video ya,negatif,netral,netral
503,tambahkan android tv pliss,netral,netral,netral
504,ke sini komersial sekali yaela segini aku ingin dengar generasi fm pasti dengar iklan berulang ulang membosankan tidak begitu begitu kalau ingin podcast pasti uang 20an ribu woy podcast yutube itu banyak gratis noice sudah itu kapitalis sekali,netral,netral,netral
505,eror 1 radio tidak diputar contoh voks radio jogja 2 memutar radio tiba-tiba ganti podcast 3 aplikasi tutup terkadang widget pemutar tidak hilang versi terima kasih teman aku lop ayo,netral,negatif,negatif
506,pembaruan aneh sinyal menonton aplikasi lancar noice ngelag unduh offline tidak aneh sekali,netral,negatif,negatif
507,konten episode pakai koin kalau memang inginnya begitu lebih baik langganan bulanan bayar akses spotify premium,netral,netral,netral
508,coba saja entar kalau nyaman aku jadikan aplikasi favorit kalau sampai eror bikin ngedelay ngecrash ngeleg ponsel aku aku uninstall,netral,netral,netral
509,aplikasi bagus sekali ke sini konten berbayar jadi unduh kapitalis sekali sialan,netral,netral,netral
510,aplikasi yang menemani tidur,netral,netral,netral
511,ya aplikasi bermanfaat positive pengembangan,netral,netral,netral
512,bingung mencari podcast ingin didengar tidak ya,netral,netral,netral
513,fitur langsung nge eror mohon perbaiki,netral,negatif,negatif
514,tlg diperbaiki tiba mati dengarkan podcast,netral,netral,negatif
515,cerita sat mendengar ya saran juga koin kurangi hitam mahalnya ya,netral,netral,netral
516,maaf ini pasti tidak notifikasi nya sudah appnya notifnya,negatif,netral,netral
517,iklannya tolong laah menyebalkan ganti episode saja langsung iklan sudah begitu episode nya sudah diplay jadi langsung keganti iklan mohon diperbaiki menyebalkan,netral,netral,netral
518,admin ya tibaÂ² berhenti begitu koneksinya lag berpengaruh,netral,netral,negatif
519,pembaruan fitur sinkron android tv seperti sebenarnya ijo,netral,netral,netral
